Month No.,Month-Day(s)-Events9,"['August 1 – Operation Tidal Wave: 177 B-24 Liberator bombers from the U.S. Army Air Force bomb oil refineries at Ploiești, Romania.', ""August 2 – WWII: John F. Kennedy's PT boat PT-109 is run down by Japanese destroyer Amagiri."", 'August 4 – WWII: The aircraft carrier USS\xa0Intrepid\xa0(CV-11) is launched at Newport News, Virginia.', ""August 5 – WWII:\nUnited States Women Airforce Service Pilots (WASPs) are formed, consolidating the Women's Auxiliary Ferrying Squadron (WAFS) and Women Airforce Service Pilots (WFTD).\nJohn F. Kennedy and crew are found by Solomon Islands coastwatchers Biuku Gasa and Eroni Kumana, with their dugout canoe."", ""United States Women Airforce Service Pilots (WASPs) are formed, consolidating the Women's Auxiliary Ferrying Squadron (WAFS) and Women Airforce Service Pilots (WFTD)."", 'John F. Kennedy and crew are found by Solomon Islands coastwatchers Biuku Gasa and Eroni Kumana, with their dugout canoe.', 'August 6 – WWII: Battle of Vella Gulf: Americans defeat a Japanese convoy off Kolombangara, as the U.S. Army drives the Japanese out of Munda airfield on New Georgia.', 'August 14\nWWII: Rome is declared an open city by the Italian government, with Italy offering to demilitarize the capital, in return for an Allied agreement not to bomb the city further.\nThe Quadrant Conference begins in Quebec City; Canadian Prime Minister MacKenzie King meets with Winston Churchill and Franklin D. Roosevelt.', 'WWII: Rome is declared an open city by the Italian government, with Italy offering to demilitarize the capital, in return for an Allied agreement not to bomb the city further.', 'The Quadrant Conference begins in Quebec City; Canadian Prime Minister MacKenzie King meets with Winston Churchill and Franklin D. Roosevelt.', 'August 17 – WWII:\nThe Seventh U.S. Army, under General George S. Patton, meets the Eighth British Army under Field Marshal B. L. Montgomery in Messina, Sicily, completing the Allied invasion of Sicily\nOperation Hydra: The British Royal Air Force sets out to bomb the Peenemünde Army Research Center, to disrupt the German V-weapons programme.', 'The Seventh U.S. Army, under General George S. Patton, meets the Eighth British Army under Field Marshal B. L. Montgomery in Messina, Sicily, completing the Allied invasion of Sicily', 'Operation Hydra: The British Royal Air Force sets out to bomb the Peenemünde Army Research Center, to disrupt the German V-weapons programme.', ""August 21 – 1943 Australian federal election: John Curtin's Labor Government defeats the Country/UAP Coalition, led by former Prime Minister Arthur Fadden. Labor achieves its greatest ever electoral result, including winning every seat (except one) outside of the eastern states. Notably, this election marked the first time that a woman has been elected to both the Senate and the House of Representatives. Fadden will step down from the Opposition leadership, handing it over to Robert Menzies, who will go on to dissolve the UAP and form the Liberal Party shortly after."", 'August 23 – WWII: The Battle of Kursk ends, with a strategic defeat for the German forces.', 'August 24 – Heinrich Himmler is named Reichsminister of the Interior in Germany.', 'August 26 – WWII: Louis Mountbatten is named Supreme Allied Commander for Southeast Asia.', 'August 28 – WWII: King Boris III of Bulgaria dies under suspicious circumstances; his 6-year-old son, Simeon II, ascends to the throne.', 'August 29 – WWII: Occupation of Denmark – Germany dissolves the Danish government, after it refuses to deal with a wave of strikes and disturbances to the satisfaction of the German authorities.']"
10,"['September 3 – WWII: Allied invasion of Italy\nArmistice of Cassibile: The Kingdom of Italy surrenders to the Allies in a document signed on Sicily but not made public at this time.\nOperation Baytown: Mainland Italy is invaded by Allied forces under General Bernard Montgomery, for the first time in the war.', 'Armistice of Cassibile: The Kingdom of Italy surrenders to the Allies in a document signed on Sicily but not made public at this time.', 'Operation Baytown: Mainland Italy is invaded by Allied forces under General Bernard Montgomery, for the first time in the war.', 'September 5 – WWII: The 503rd Parachute Regiment (under American General Douglas MacArthur) lands and occupies Nadzab, just east of the port city of Lae, in northeastern Papua New Guinea.', 'September 7 – Gulf Hotel fire: A fire at the Gulf Hotel in Houston, Texas kills 55.', 'September 8\nWWII: United States General Dwight D. Eisenhower publicly announces the surrender of Italy to the Allies.\nWWII: Frascati air raid: The USAAF bombs the German General Headquarters for the Mediterranean zone.\nThe first classes commence at Grace University in Omaha, Nebraska.', 'WWII: United States General Dwight D. Eisenhower publicly announces the surrender of Italy to the Allies.', 'WWII: Frascati air raid: The USAAF bombs the German General Headquarters for the Mediterranean zone.', 'The first classes commence at Grace University in Omaha, Nebraska.', ""September 9 – Bertolt Brecht's play Life of Galileo (German: Leben des Galilei) receives its first theatrical production, at the Schauspielhaus Zürich."", 'September 12 – WWII: Gran Sasso raid – German paratroopers rescue Mussolini from imprisonment, in Unternehmen Eiche (""Operation Oak"").', ""September 16 – WWII: Salerno Mutiny – Soldiers of the British Army's X Corps refuse postings to new units."", 'September 17 – WWII: Villefranche-de-Rouergue Mutiny – A group of pro-Partisan soldiers, led by Ferid Džanić and others within the 13th Waffen Mountain Division of the SS Handschar (1st Croatian), training in Occupied France, rise against Nazi German troops in the Division; the revolt is rapidly suppressed.', 'September 21–26 – WWII: Massacre of the Acqui Division – German soldiers of the 1st Mountain Division (Wehrmacht) kill over 5,100 Italian military internees resisting disarmament on the Greek island of Cephalonia.', 'September 22–October 2 – WWII: Landing at Scarlet Beach on the Huon Peninsula of New Guinea by Allied forces, the first time Australian troops have made an opposed amphibious landing since the Gallipoli Campaign of 1915.', 'September 23 – WWII: The Italian Social Republic (""Republic of Salò"") is founded in northern Italy as a puppet state of Nazi Germany.', 'September 25 – WWII: The Russian city of Smolensk is liberated by Soviet forces as part of the successful Smolensk operation against German defenders.', 'September 27 – WWII: Four days of Naples begins: a popular uprising drives German occupying forces from the city.']"
11,"['October 1 – WWII: United States forces enter liberated Naples.', 'October 3 – WWII: Nazi Wehrmacht forces commit the Lyngiades massacre in northwest Greece as an arbitrary reprisal.', 'October 6 – WWII: Americans and Japanese fight the naval Battle of Vella Lavella.', 'October 7 – WWII: The Naples post-office bombing kills 100.', 'October 10\nWWII: Double Tenth incident (Japanese occupation of Singapore): The Japanese military police, the Kempeitai, arrest and torture more than 50 civilians and civilian internees, on false suspicion of their involvement in a raid on Singapore Harbour during Operation Jaywick.\nThe Order of Bogdan Khmelnitsky is instituted in the Soviet Union.', 'WWII: Double Tenth incident (Japanese occupation of Singapore): The Japanese military police, the Kempeitai, arrest and torture more than 50 civilians and civilian internees, on false suspicion of their involvement in a raid on Singapore Harbour during Operation Jaywick.', 'The Order of Bogdan Khmelnitsky is instituted in the Soviet Union.', 'October 13 – WWII: The new government of Italy sides with the Allies and declares war on Germany.', 'October 14\nWWII: During the Second Raid on Schweinfurt, the United States Eighth Air Force suffers so many losses, that it loses air supremacy over Germany for several months.\nThe Holocaust: Uprising in Sobibór extermination camp; about half the inmates escape. Three days later, the camp is closed.\nJosé P. Laurel takes the oath of office as President of the Philippines (Second Philippine Republic).', 'WWII: During the Second Raid on Schweinfurt, the United States Eighth Air Force suffers so many losses, that it loses air supremacy over Germany for several months.', 'The Holocaust: Uprising in Sobibór extermination camp; about half the inmates escape. Three days later, the camp is closed.', 'José P. Laurel takes the oath of office as President of the Philippines (Second Philippine Republic).', 'October 16 – The Holocaust: Raid of the Ghetto of Rome – Over a thousand Jews are rounded up in Rome by the Gestapo; only 16 will survive their deportation to Auschwitz concentration camp. The public silence of Pope Pius XII on the raid becomes a matter of historical controversy.', 'October 17 – WWII:\nThe last commerce raider, German auxiliary cruiser Michel, is sunk off Japan by United States submarine Tarpon.\nThe Burma Railway is completed between Bangkok, Thailand and Rangoon, Burma (modern-day Myanmar) (415\xa0km (258\xa0mi)) by the Empire of Japan, to support its forces in the Burma campaign, using the forced labour of Asian civilians and Allied Prisoners of war.', 'The last commerce raider, German auxiliary cruiser Michel, is sunk off Japan by United States submarine Tarpon.', 'The Burma Railway is completed between Bangkok, Thailand and Rangoon, Burma (modern-day Myanmar) (415\xa0km (258\xa0mi)) by the Empire of Japan, to support its forces in the Burma campaign, using the forced labour of Asian civilians and Allied Prisoners of war.', 'October 18 – Chiang Kai-shek takes the oath of office as Chairman of the National Government of China.', 'October 19 – WWII: Allied aircraft sink the German-controlled cargo ship MS\xa0Sinfra in the Mediterranean, killing over 2,000 people, mostly Italian military internees.', 'October 21 – Lucie Aubrac and others in her French Resistance cell liberate Raymond Aubrac from Gestapo imprisonment.', 'October 22 – WWII: Bombing of Kassel in World War II: The British Royal Air Force delivers a highly destructive airstrike on the German industrial and population center of Kassel; at least 10,000 are killed and 150,000 are made homeless.', ""October 24 – WWII: British Royal Navy destroyer HMS\xa0Eclipse\xa0(H08) is sunk by a mine in the Aegean Sea, with the loss of 119 of the ship's company and 134 troops."", 'October 30\nWWII: Signing of Moscow Declarations: the Declaration of the Four Nations on general security, by the United States, United Kingdom, Soviet Union and Republic of China; and the Declarations on Italy, Austria and Atrocities by the first three governments.\nThe Merrie Melodies animated cartoon Falling Hare, one of the only shorts with Bugs Bunny getting out-smarted, is released in the United States.', 'WWII: Signing of Moscow Declarations: the Declaration of the Four Nations on general security, by the United States, United Kingdom, Soviet Union and Republic of China; and the Declarations on Italy, Austria and Atrocities by the first three governments.', 'The Merrie Melodies animated cartoon Falling Hare, one of the only shorts with Bugs Bunny getting out-smarted, is released in the United States.']"
12,"['November 1 – WWII: Operation Goodtime: United States Marines land on Bougainville Island in the Solomon Islands.', 'November 2 – WWII:\nBattle of Empress Augusta Bay off Bougainville Island: American and Japanese ships fight to a draw.\nWWII: British troops in Italy reach the Garigliano River.', 'Battle of Empress Augusta Bay off Bougainville Island: American and Japanese ships fight to a draw.', 'WWII: British troops in Italy reach the Garigliano River.', 'November 3–4 – The Holocaust: Aktion Erntefest (""Operation Harvest Festival"") – The largest single day massacre of Jews in the entire war takes place when over 43,000 Jews are shot-gunned to death by the SS, the Ordnungspolizei and the ""Trawniki men"" (Ukrainian collaborators) in Sonderdienst formations at the Majdanek, Trawniki and Poniatowa concentration camps in the General Government territory of occupied Poland.', 'November 5 – WWII: First Bombing of the Vatican – Four bombs are dropped on the neutral Vatican City; the aircraft responsible is never certainly identified.', 'November 6 – WWII: The Ukrainian capital of Kiev is liberated by Soviet forces  from its German occupiers as part of the Battle of Kiev.', 'November 9 – An agreement for the foundation of the United Nations Relief and Rehabilitation Administration is signed by 44 countries in the White House, Washington, D.C.', 'November 10 – The Lübeck martyrs, four men of religion, are executed for supposedly treasonable views.', 'November 14 – Leonard Bernstein, substituting at the last minute for ailing principal conductor Bruno Walter, directs the New York Philharmonic in its regular Sunday afternoon broadcast concert, over CBS Radio. The event receives front-page coverage in The New York Times the following day.', 'November 15 – Porajmos: German SS leader Heinrich Himmler orders that Gypsies be put ""on the same level as Jews and placed in Nazi concentration camps.""', 'November 16 – WWII:\nAfter flying from Britain, 160 American bombers strike a hydro-electric power facility and heavy water factory in German-controlled Vemork, Norway.\nA Japanese submarine sinks the surfaced U.S. submarine USS\xa0Corvina, near Chuuk Lagoon (Truk).', 'After flying from Britain, 160 American bombers strike a hydro-electric power facility and heavy water factory in German-controlled Vemork, Norway.', 'A Japanese submarine sinks the surfaced U.S. submarine USS\xa0Corvina, near Chuuk Lagoon (Truk).', 'November 18 – WWII: Battle of Berlin – The British Royal Air Force opens its bombing campaign against Berlin with 440 planes, causing only light damage and killing 131. The RAF loses 9 aircraft and 53 aviators.', 'November 19 – The Holocaust: Inmates of Janowska concentration camp, near Lwów (at this time in German-occupied Poland), stage a failed uprising, after which the SS liquidates the camp, resulting in at least 6,000 deaths.', 'November 20 – WWII: Battle of Tarawa: United States Marines land on Tarawa and Makin atolls in the Gilbert Islands (Kiribati from 1979) and take heavy fire from Japanese shore guns.', 'November 22–26 – WWII: Cairo Conference (""Sextant"") – President of the United States Franklin D. Roosevelt, Prime Minister of the United Kingdom Winston Churchill and Chairman of the National Government of China Chiang Kai-shek meet at Cairo, Egypt, to discuss ways to defeat Japan in the Pacific War.', 'November 22 – Lebanon gains independence, upon the ending of the French Mandate.', 'November 23 – The Deutsches Opernhaus on Bismarckstraße, in the Berlin district of Charlottenburg, is destroyed in an air raid (it is reopened in 1961, as the Deutsche Oper Berlin).', 'November 25 – WWII: Americans and Japanese fight the naval Battle of Cape St. George, between Buka and New Ireland.', 'November 26 – WWII: British troopship HMT Rohna is sunk off the north African coast by a Luftwaffe Henschel Hs 293 radio controlled glide bomb, killing 1,015.', 'November 27 – The 1943 Tosya–Ladik earthquake in Turkey kills thousands.', 'November 28 – WWII: Tehran Conference: U.S. President Franklin D. Roosevelt, British Prime Minister Winston Churchill and Soviet leader Joseph Stalin meet in Tehran, to discuss war strategy. On November 30, they establish an agreement concerning a planned June 1944 invasion of Europe, codenamed Operation Overlord.', 'November 29 – The second session of AVNOJ, the Anti-Fascist Council of National Liberation of Yugoslavia, is held in Jajce, Bosnia and Herzegovina, to determine the post-war ordering of the country.']"
13,"['December 2 – WWII: Bari chemical warfare disaster: A surprise Luftwaffe air raid on Bari, Italy sinks 28 Allied ships in the harbor, including the American Liberty ship SS\xa0John Harvey, releasing its secret cargo of mustard gas bombs, inflating the number of casualties.', 'December 3\nIn reprisal for an act of sabotage, the SS and Gestapo execute 100 Warsaw Tramway workers.\nEdward R. Murrow delivers his classic ""Orchestrated Hell"" broadcast over CBS Radio, describing a Royal Air Force nighttime bombing raid on Berlin.', 'In reprisal for an act of sabotage, the SS and Gestapo execute 100 Warsaw Tramway workers.', 'Edward R. Murrow delivers his classic ""Orchestrated Hell"" broadcast over CBS Radio, describing a Royal Air Force nighttime bombing raid on Berlin.', 'December 4\nWWII: In Yugoslavia, resistance leader Marshal Tito proclaims a provisional democratic Yugoslav government-in-exile.\nWith unemployment figures falling fast due to WWII-related employment, U.S. President Franklin D. Roosevelt closes the Works Progress Administration.\nWWII: Bolivia declares war on Romania and Hungary.', 'WWII: In Yugoslavia, resistance leader Marshal Tito proclaims a provisional democratic Yugoslav government-in-exile.', 'With unemployment figures falling fast due to WWII-related employment, U.S. President Franklin D. Roosevelt closes the Works Progress Administration.', 'WWII: Bolivia declares war on Romania and Hungary.', 'December 7 – Chiara Lubich starts the humanitarian Focolare Movement in Trento, Italy.', 'December 13 – WWII: Massacre of Kalavryta – The occupying 117th Jäger Division (Wehrmacht) machine-guns all adult males from Kalavryta, Greece, subsequently burning the town.', 'December 15 – WWII: American and Australian forces begin the Battle of Arawe as a diversion before a larger landing at Cape Gloucester on New Britain, in Papua New Guinea.', 'December 20 – A military coup is staged in Bolivia.', 'December 20–28 – WWII: Italian Campaign – Battle of Ortona: Canadian infantry defeat elite German paratroops.', 'December 24 – WWII: U.S. General Dwight D. Eisenhower becomes Supreme Allied Commander Europe. He establishes the Supreme Headquarters Allied Expeditionary Force in London.', ""December 26 – WWII: Battle of the North Cape – German battleship Scharnhorst is torpedoed and sunk in a night action north of the Arctic Circle by British battleship HMS Duke of York and her escorts with the loss of all but 36 of the German crew of 1,943 (including Admiral Erich Bey); this is the war's last action between big-gun capital ships of Britain and Germany."", 'December 30 – Subhas Chandra Bose sets up a pro-Japanese Indian government at Port Blair, India.', ""December 31 - The Times Square Ball in Times Square, New York City isn't dropped a second time. Instead, there was a moment of silence at midnight, followed by the sound of bells playing from sound trucks at the base of One Times Square.""]"
