Month No.,Month-Day(s)-Events
1,"['January 1 – WWII: The Soviet Union announces that 22 German divisions have been encircled at Stalingrad, with 175,000 killed and 137,650 captured.', 'January 4 – WWII: Greek-Polish athlete and saboteur Jerzy Iwanow-Szajnowicz is executed by the Germans at Kaisariani.', 'January 11\nThe United States and United Kingdom revise previously unequal treaty relationships with the Republic of China.\nItalian-American anarchist Carlo Tresca is assassinated in New York City.', 'The United States and United Kingdom revise previously unequal treaty relationships with the Republic of China.', 'Italian-American anarchist Carlo Tresca is assassinated in New York City.', 'January 13 – Anti-Nazi protests in Sofia result in 200 arrests and 36 executions.', 'January 14 – 24 – WWII: Casablanca Conference: Franklin D. Roosevelt, President of the United States; Winston Churchill, Prime Minister of the United Kingdom; and Generals Charles de Gaulle and Henri Giraud of the Free French forces meet secretly at the Anfa Hotel in Casablanca, Morocco, to plan the Allied European strategy for the next stage of the war.', 'January 15 - WWII: Guadalcanal Campaign – Operation Ke: Japanese forces begin to withdraw from Guadalcanal in the Solomon Islands.', 'January 16 – Iraq declares war on the Axis powers.', ""January 18\nWWII: Soviet officials announce that the Red Army has broken the Wehrmacht's siege of Leningrad as part of Operation Iskra, opening a narrow land corridor to the city. Georgy Zhukov is promoted to Marshal of the Soviet Union.\nThe first Warsaw Ghetto Uprising begins: several days engagement with the Germans limits the number of Jews deported at this time."", ""WWII: Soviet officials announce that the Red Army has broken the Wehrmacht's siege of Leningrad as part of Operation Iskra, opening a narrow land corridor to the city. Georgy Zhukov is promoted to Marshal of the Soviet Union."", 'The first Warsaw Ghetto Uprising begins: several days engagement with the Germans limits the number of Jews deported at this time.', 'January 21 – WWII: Pan Am Flight 1104 – Pan American Airways Martin M-130 flying boat crashes about 7\xa0mi (11\xa0km) southwest of Ukiah, California. All 10 passengers and 9 crew aboard are killed, including Admiral Robert H. English (at this time COMSUBPAC).', 'January 22\nWWII: Battle of Buna–Gona: American and Australian forces secure control of the territory of Papua.\nThe Holocaust: Round up of Marseille begins – Over 4,000 Jews are detained in Nazi-occupied Marseille as part of ""Action Tiger"", before being transported to extermination camps in Poland.', 'WWII: Battle of Buna–Gona: American and Australian forces secure control of the territory of Papua.', 'The Holocaust: Round up of Marseille begins – Over 4,000 Jews are detained in Nazi-occupied Marseille as part of ""Action Tiger"", before being transported to extermination camps in Poland.', ""January 23\nWWII: British forces capture Tripoli from the Italians.\nAmerican critic and commentator Alexander Woollcott suffers an eventually fatal heart attack, during a regular broadcast of the CBS Radio round-table program People's Platform."", 'WWII: British forces capture Tripoli from the Italians.', ""American critic and commentator Alexander Woollcott suffers an eventually fatal heart attack, during a regular broadcast of the CBS Radio round-table program People's Platform."", 'January 27 – WWII: 50 bombers mount the first all American air raid against Germany: Wilhelmshaven is the target.', ""January 29\nNazi German police arrest alleged necrophiliac and serial killer Bruno Lüdke.\nThe United States Marine Corps Women's Reserve (MCWR) is created."", 'Nazi German police arrest alleged necrophiliac and serial killer Bruno Lüdke.', ""The United States Marine Corps Women's Reserve (MCWR) is created."", ""January 29–30 – WWII: Battle of Rennell Island – The Imperial Japanese Navy resists the United States Navy's attempt to interrupt the withdrawal of Japanese forces from Guadalcanal, in the last major naval battle of the Guadalcanal Campaign."", 'January 29–31 – WWII: Battle of Wau – Australian forces, with United States support, resist a Japanese advance in the New Guinea campaign.', 'January 30 – WWII: German General Friedrich Paulus is promoted to the rank of Field Marshal and instructed to fight to the death in Stalingrad, while Karl Dönitz is promoted to Commander in Chief of the German Navy, replacing Erich Raeder.']"
2,"['February 2 – WWII: In Russia, the Battle of Stalingrad comes to an end, with the surrender of the German 6th Army.', 'February 3 – WWII: The Four Chaplains of the U.S. Army are among those drowned when their ship, Dorchester, is struck by a German torpedo in the North Atlantic.', 'February 5 – Lt. General Frank M. Andrews is selected to command the U.S. armies in Europe, while General Dwight D. Eisenhower is assigned command in North Africa. Andrews will serve only 3 months, before dying in an airplane crash.', 'February 6 – WWII: RCN corvette HMCS Louisburg is bombed and sunk off Oran, Algeria by Italian aircraft.', 'February 7 – WWII: North Atlantic convoy SC 118 is attacked by U-boats, who sink 8 ships.', 'February 9\nWWII: The Guadalcanal Campaign in the Solomon Islands ends with United States forces in command of Guadalcanal, the evacuation of Japanese forces in Operation Ke having been completed two days earlier.\nWWII: Massacres of Poles in Volhynia and Eastern Galicia by the Ukrainian Insurgent Army begin, with the Parośla I massacre within the Reichskommissariat Ukraine.\nThe Holocaust: Rue Sainte-Catherine Roundup – The Gestapo, directed by Klaus Barbie, arrest 86 Jews in Lyon.', 'WWII: The Guadalcanal Campaign in the Solomon Islands ends with United States forces in command of Guadalcanal, the evacuation of Japanese forces in Operation Ke having been completed two days earlier.', 'WWII: Massacres of Poles in Volhynia and Eastern Galicia by the Ukrainian Insurgent Army begin, with the Parośla I massacre within the Reichskommissariat Ukraine.', 'The Holocaust: Rue Sainte-Catherine Roundup – The Gestapo, directed by Klaus Barbie, arrest 86 Jews in Lyon.', 'February 10–March 3 – Mohandas Gandhi (under arrest by forces of the British Raj in Pune as a member of the Quit India Movement) keeps a hunger strike to protest his imprisonment.', 'February 14 – WWII: Rostov-on-Don in Russia is liberated.', 'February 14–17 – WWII: Battle of Sidi Bou Zid: In the Tunisia Campaign, German Panzer divisions commanded by Hans-Jürgen von Arnim are victorious over the United States Army.', 'February 16 – WWII: The Soviet Union reconquers Kharkiv, but is later driven out in the Third Battle of Kharkiv.', 'February 18\nIn a Sportpalast speech in Berlin, German Propaganda Minister Joseph Goebbels declares a ""total war"" against the Allies, tacitly admitting that Nazi Germany faces serious dangers.\nThe Nazis arrest the members of the White Rose German Resistance movement.', 'In a Sportpalast speech in Berlin, German Propaganda Minister Joseph Goebbels declares a ""total war"" against the Allies, tacitly admitting that Nazi Germany faces serious dangers.', 'The Nazis arrest the members of the White Rose German Resistance movement.', ""February 19–24 – WWII: Battle of Kasserine Pass: German General Erwin Rommel's Afrika Korps and other Axis forces launch an offensive against Allied defenses in Tunisia; it is the United States' first major battle defeat of the war. On February 22, an Anglo-American force halts the German advance near Thala, forcing the Germans to retreat, US bombers harass the retreating Panzers."", 'February 20\nAmerican movie studio executives agree to allow the Office of War Information to censor movies.\nThe Parícutin volcano begins to appear in a cornfield in Mexico.', 'American movie studio executives agree to allow the Office of War Information to censor movies.', 'The Parícutin volcano begins to appear in a cornfield in Mexico.', 'February 21 – WWII: North Atlantic convoy ON 166 is attacked by U-boats, who sink eleven ships.', 'February 22\nWWII: RCN corvette HMCS Weyburn sinks east of Gibraltar, after being mined.\nMembers of the White Rose are executed in Nazi Germany.', 'WWII: RCN corvette HMCS Weyburn sinks east of Gibraltar, after being mined.', 'Members of the White Rose are executed in Nazi Germany.', ""February 23–24 – Cavan Orphanage Fire: 35 girls and a cook from St Joseph's Orphanage, an industrial school at Cavan, Ireland, are killed in a fire in their dormitories. A subsequent inquiry absolves the Poor Clares of blame."", 'February 28 – Operation Gunnerside: 6 Norwegians, led by Joachim Rønneberg, successfully attack the heavy water plant at Vemork.']"
3,"[""March – Exiled French aviator Antoine de Saint-Exupéry's self-illustrated children's novella, The Little Prince, is published in New York City, the all-time best-selling book originating in French."", ""March–December – History of computing hardware: British prototype Mark I Colossus computer is constructed (the world's first totally electronic programmable computing device) to assist in cryptanalysis of German signals at Bletchley Park."", 'March 1 – Heinz Guderian becomes Inspector-General of the Armoured Troops for the German Army.', 'March 1–2 – WWII: Koriukivka massacre – 6,700 inhabitants of Koriukivka are murdered in the Ukraine, by a German SS unit.', 'March 2 – WWII: Battle of the Bismarck Sea – United States and Australian forces sink Japanese convoy ships, then strafe survivors in the water.', 'March 3 – 173 people are killed in a crush while trying to enter an air-raid shelter at Bethnal Green, London.', 'March 4\nAs part of The Holocaust in Bulgarian-occupied Greece, almost all Jews in the region are rounded up to be taken to Treblinka extermination camp.\nThe 15th Academy Awards ceremony is held in Los Angeles. Mrs. Miniver wins the Best Picture Award.', 'As part of The Holocaust in Bulgarian-occupied Greece, almost all Jews in the region are rounded up to be taken to Treblinka extermination camp.', 'The 15th Academy Awards ceremony is held in Los Angeles. Mrs. Miniver wins the Best Picture Award.', 'March 4–6 – WWII: Battle of Fardykambos – Greek partisans and armed civilians force the surrender of an Italian army battalion.', 'March 5 – The Gloster Meteor, the first Allied jet fighter, makes its first flight, in England.', 'March 9–10 – WWII: North Atlantic convoy SC 121 is attacked by U-boats sinking seven ships.', 'March 9 – Şükrü Saracoğlu forms the new government of Turkey (14th government; Şükrü Saracoğlu had served twice as a prime minister).', 'March 10 – Banco Bradesco is founded in Marília, São Paulo, Brazil.', 'March 12 – WWII: Italian occupation of Greece: The Italian occupying forces abandon the town of Karditsa to the partisans. On the same day, an Italian motorized column razes the village of Tsaritsani, burning 360 of its 600 houses and shooting 40 civilians.', 'March 13 – The Holocaust: Nazi German forces liquidate the Jews of the Kraków Ghetto, in Occupied Poland.', 'March 14 – WWII: British submarine HMS Thunderbolt is sunk off Sicily by an Italian corvette, the second time this vessel has been lost with all hands.', 'March 15 – WWII:\nItalian submarine Leonardo da Vinci sinks Canadian Pacific liner RMS Empress of Canada off Sierra Leone. Nearly half of the 392 fatalities are Italian prisoners of war.\nGerman forces recapture Kharkiv after four days of house-to-house fighting against Soviet troops, ending the month-long Third Battle of Kharkiv.', 'Italian submarine Leonardo da Vinci sinks Canadian Pacific liner RMS Empress of Canada off Sierra Leone. Nearly half of the 392 fatalities are Italian prisoners of war.', 'German forces recapture Kharkiv after four days of house-to-house fighting against Soviet troops, ending the month-long Third Battle of Kharkiv.', 'March 16–19 – WWII: 22 ships from Convoys HX 229/SC 122 and one U-boat are sunk in the largest North Atlantic U-boat ""wolfpack"" attack of the war.', 'March 17 (Saint Patrick\'s Day) – Éamon de Valera, Taoiseach of the Republic of Ireland, makes the speech ""The Ireland That We Dreamed Of"", commonly called the ""comely maidens"" speech, in Dublin Castle.', 'March 22 – WWII: Khatyn massacre – The entire population of Khatyn, Belarus is burnt alive by German occupation forces.', 'March 23 – The drugs Vicodin and Lortab are first produced in Germany.', 'March 26 – WWII: Battle of the Komandorski Islands: In the Aleutian Islands, the battle begins when United States Navy forces intercept Japanese troops attempting to reinforce a garrison at Kiska.', 'March 27 – WWII: British Royal Navy escort carrier HMS\xa0Dasher\xa0(D37) is destroyed by an accidental explosion in the Firth of Clyde, killing 379 of the crew of 528.', 'March 28 – In Italy a ship full of weapons and ammunition explodes in the port of Naples, killing 600.']"
4,"['April 3 – Shipwrecked steward Poon Lim, BEM, is rescued by Brazilian fishermen after being adrift for 133 days.', 'April 13 – WWII: Radio Berlin announces the discovery by Wehrmacht of mass graves of Poles killed by Soviets in the Katyn massacre.', 'April 19\nHistory of lysergic acid diethylamide: Albert Hofmann self-administers the psychedelic drug LSD (which he first synthesized in 1938) for the first time in history and records the details of his experience.\nThe Holocaust: The Warsaw Ghetto Uprising begins when Nazi troops enter the Warsaw Ghetto to round up remaining Jews.', 'History of lysergic acid diethylamide: Albert Hofmann self-administers the psychedelic drug LSD (which he first synthesized in 1938) for the first time in history and records the details of his experience.', 'The Holocaust: The Warsaw Ghetto Uprising begins when Nazi troops enter the Warsaw Ghetto to round up remaining Jews.', 'April 21 – WWII:\nAberdeen, Scotland, experiences its worst bombing, with 125 people killed.\nThe first German Tiger I tank is captured in North Africa by British forces.', 'Aberdeen, Scotland, experiences its worst bombing, with 125 people killed.', 'The first German Tiger I tank is captured in North Africa by British forces.', 'April 25 – Easter occurs on the latest possible date (last time 1886; next time 2038) in the Western Christian Church.', ""April 27 – The U.S. Federal Writers' Project ceases operation.""]"
5,"['May 6 – WWII: Six U-boats are sunk, after sinking 12 ships from Convoy ONS 5, in the last major North Atlantic U-boat ""wolfpack"" attack of the war.', 'May 9–12 – Japanese troops carry out the Changjiao massacre in Changjiao, Hunan, China.', 'May 11 – WWII: American troops invade Attu in the Aleutian Islands, in an attempt to expel occupying Japanese forces.', 'May 12 – The Third Washington Conference (""Trident"") begins in Washington, D.C., with Franklin D. Roosevelt and Winston Churchill taking part.', 'May 13 – WWII: German Afrika Korps and Italian troops in North Africa surrender to Allied forces.', ""May 14\nAustralian Hospital Ship Centaur is sunk off the coast of Queensland by Japanese submarine \xa0I-177, killing 268 of the 332 medical personnel and civilian crew aboard.\nThe 358th Bombardment Squadron, 303d Bombardment Group B-17F Hell's Angels is the first USAAF bomber to complete 25 missions."", 'Australian Hospital Ship Centaur is sunk off the coast of Queensland by Japanese submarine \xa0I-177, killing 268 of the 332 medical personnel and civilian crew aboard.', ""The 358th Bombardment Squadron, 303d Bombardment Group B-17F Hell's Angels is the first USAAF bomber to complete 25 missions."", 'May 15 – The Comintern is dissolved in Moscow.', ""May 16–17 – WWII: Operation Chastise (the 'Dambuster Raid') takes place: No. 617 Squadron RAF use bouncing bombs to breach German dams in the Ruhr Valley."", 'May 16 – Holocaust: The Warsaw Ghetto Uprising ends. 13,000 Jews have been killed in the ghetto and almost all the remaining 50,000 residents are deported to Majdanek and Treblinka extermination camps.', ""May 17 – WWII:\nThe United States Army contracts with the University of Pennsylvania's Moore School to develop the computer ENIAC.\nThe Memphis Belle's crew becomes the first aircrew in the 8th Air Force to complete its 25-mission tour of duty. The aircraft and crew are the first to return to the U.S. intact for a War Bond drive."", ""The United States Army contracts with the University of Pennsylvania's Moore School to develop the computer ENIAC."", ""The Memphis Belle's crew becomes the first aircrew in the 8th Air Force to complete its 25-mission tour of duty. The aircraft and crew are the first to return to the U.S. intact for a War Bond drive."", 'May 19 – Winston Churchill addresses a joint session of the United States Congress.', 'May 23 – WWII: The battleship USS\xa0New Jersey\xa0(BB-62) is commissioned at Philadelphia, Pennsylvania.', 'May 27 – The port city of Maizuru is founded in Japan.', ""May 29 – Norman Rockwell's illustration of 'Rosie the Riveter' first appears, on the cover of The Saturday Evening Post."", 'May 30\nThe Holocaust: Dr. Josef Mengele begins his position as a medical officer in the Auschwitz-Birkenau concentration camp.\nWWII: The Battle of Attu ends in the Aleutian Islands with an American victory over the Japanese forces there.', 'The Holocaust: Dr. Josef Mengele begins his position as a medical officer in the Auschwitz-Birkenau concentration camp.', 'WWII: The Battle of Attu ends in the Aleutian Islands with an American victory over the Japanese forces there.']"
6,"['June 1 – BOAC Flight 777, a scheduled passenger flight, is shot down over the Bay of Biscay by German Junkers Ju 88s; all 17 persons aboard perish, including actor Leslie Howard.', 'June 3\nThe Zoot Suit Riots erupt between military personnel and Mexican-American youths in East Los Angeles.\nThe French Committee of National Liberation (Comité Français de Libération Nationale, CFLN) is formed with headquarters in Algiers and Generals Charles de Gaulle and Henri Giraud as co-presidents.', 'The Zoot Suit Riots erupt between military personnel and Mexican-American youths in East Los Angeles.', 'The French Committee of National Liberation (Comité Français de Libération Nationale, CFLN) is formed with headquarters in Algiers and Generals Charles de Gaulle and Henri Giraud as co-presidents.', ""June 4 – A military coup d'état in Argentina ousts Ramón Castillo."", 'June 8 – WWII: Japanese battleship Mutsu is destroyed by an accidental magazine explosion, in Hashirajima anchorage.', ""June 8–9 – WWII: Battle of Porta: The Royal Italian Army is defeated by the Greek People's Liberation Army."", 'June 20–23 – The Detroit race riot of 1943 in the United States kills 34 people (25 African Americans, 9 whites), wounds hundreds more and damages and destroys property worth millions.', 'June 21 – WWII: As part of Operation Animals, British Special Operations Executive saboteurs destroy the railway bridge over the Asopos River in ""Operation Washing"", and guerrillas of the Greek People\'s Liberation Army ambush and destroy a German convoy at the Battle of Sarantaporos.', 'June 22 – WWII: The U.S. Army 45th Infantry Division lands in North Africa, prior to training at Arzew, French Morocco.', 'June 30\nThe United States Civilian Conservation Corps is abolished.\nWWII: The New Georgia campaign begins in the Solomon Islands, an Allied offensive against the Japanese forces stationed there.', 'The United States Civilian Conservation Corps is abolished.', 'WWII: The New Georgia campaign begins in the Solomon Islands, an Allied offensive against the Japanese forces stationed there.', 'June (late) – The Holocaust: The last trainload of Jewish prisoners is moved from Bełżec extermination camp in Occupied Poland (for gassing at Sobibór), and for the remainder of the year the Nazis make efforts to obliterate the site.']"
7,"[""July 1 – The United States Women's Army Corps (WAC) is converted to full status."", 'July 4 – 1943 Gibraltar B-24 crash: The aircraft carrying General Władysław Sikorski, Prime Minister of the Polish government-in-exile, crashes, killing him and 15 others, leading to a lasting controversy over the circumstances.', 'July 5 – WWII:\nNazi Germany commences Operation Citadel. It will eventually lead to the Battle of Kursk, the largest tank battle in history.\nA fleet sets sail for the Allied invasion of Sicily.\nThe National Bands Agreement is concluded in Greece.', 'Nazi Germany commences Operation Citadel. It will eventually lead to the Battle of Kursk, the largest tank battle in history.', 'A fleet sets sail for the Allied invasion of Sicily.', 'The National Bands Agreement is concluded in Greece.', 'July 6 – WWII: Americans and Japanese fight the Battle of Kula Gulf off Kolombangara.', 'July 10\n(0245 GMT (4:45\xa0a.m. local time)) – WWII: Allied invasion of Sicily – The Allied invasion of Axis-controlled Europe begins, with landings on the island of Sicily off mainland Italy by the Seventh United States Army and the British Eighth Army, including the 1st Canadian Infantry Division.\nThe Holocaust: Jedwabne pogrom – At least 340 Polish Jews are marched to a local barn, locked inside and subsequently burned to death.', '(0245 GMT (4:45\xa0a.m. local time)) – WWII: Allied invasion of Sicily – The Allied invasion of Axis-controlled Europe begins, with landings on the island of Sicily off mainland Italy by the Seventh United States Army and the British Eighth Army, including the 1st Canadian Infantry Division.', 'The Holocaust: Jedwabne pogrom – At least 340 Polish Jews are marched to a local barn, locked inside and subsequently burned to death.', 'July 11 – WWII:\nUnited States Army forces make an assault on Piano Lupo, just outside Gela, Sicily.\nMassacres of Poles in Volhynia and Eastern Galicia by the Ukrainian Insurgent Army within the Reichskommissariat Ukraine (Volhynia) peak.', 'United States Army forces make an assault on Piano Lupo, just outside Gela, Sicily.', 'Massacres of Poles in Volhynia and Eastern Galicia by the Ukrainian Insurgent Army within the Reichskommissariat Ukraine (Volhynia) peak.', 'July 12 – WWII: Main engagement of the Battle of Prokhorovka – The Wehrmacht and the Red Army fight to a draw in one of the largest tank battles in military history.', 'July 19 – WWII: Rome is bombed by the Allies, for the first time in the war.', 'July 24 – WWII: Operation Gomorrha: British and Canadian aeroplanes bomb Hamburg by night; American planes bomb the city by day. By the end of the operation in November, 9,000 tons of explosives will have killed more than 42,000 people and destroyed 280,000 buildings.']"
8,"['July 25 – Benito Mussolini, Fascist Prime Minister of Italy since 1922, is arrested after the Grand Council of Fascism withdraws its support. ""Il Duce"" is replaced by General Pietro Badoglio.']"
