Month No.,Month-Day(s)-Events7,"['July–October – WWII: Germans are driven out of Lithuania leading to reimposition of the Lithuanian Soviet Socialist Republic.', 'July 1 – The United Nations Monetary and Financial Conference begins at Bretton Woods, New Hampshire, United States.', 'July 3 – WWII:\nSoviet troops liberate Minsk.\nBattle of Imphal: Japanese forces call off their advance, ending the battle with a British victory.', 'Soviet troops liberate Minsk.', 'Battle of Imphal: Japanese forces call off their advance, ending the battle with a British victory.', 'July 6 – WWII: At Camp Hood, Texas, future baseball star and 1st Lt. Jackie Robinson is arrested and later court-martialed, for refusing to move to the back of a segregated U.S. Army bus (he is eventually acquitted).', 'July 9 – WWII: British and Canadian forces capture Caen.', 'July 10–11 – WWII: Operation Jupiter during the Battle of Normandy of World War II: British strategic victory over German Panzer Corps.', 'July 10 – WWII: Soviet troops begin operations to liberate the Baltic countries from Nazi occupation.', 'July 12–21 – WWII: Dortan massacre – 35–36 French civilians are killed by Ostlegionen (Cossacks) serving with the Wehrmacht.', 'July 13 – WWII: Vilnius is freed by Soviet forces.', 'July 16 – WWII: The first contingent of the Brazilian Expeditionary Force arrives in Italy.', 'July 17 – WWII:\nThe largest convoy of the war embarks from Halifax Harbour, Nova Scotia, under Royal Canadian Navy protection.\nPort Chicago disaster: The SS E. A. Bryan, loaded with ammunition, explodes at the Port Chicago, California, Naval Magazine, killing 320 sailors and civilian personnel.', 'The largest convoy of the war embarks from Halifax Harbour, Nova Scotia, under Royal Canadian Navy protection.', 'Port Chicago disaster: The SS E. A. Bryan, loaded with ammunition, explodes at the Port Chicago, California, Naval Magazine, killing 320 sailors and civilian personnel.', 'July 18 – WWII:\nAmerican forces push back the Germans in Saint-Lô, capturing the city.\nBritish forces launch Operation Goodwood, an armoured offensive aimed at driving the Germans from the high ground to the south of Caen. The offensive ends 2 days later with minimal gains.\nHideki Tōjō resigns as Prime Minister of Japan due to numerous setbacks in the war effort and is succeeded on July 22 by Kuniaki Koiso.', 'American forces push back the Germans in Saint-Lô, capturing the city.', 'British forces launch Operation Goodwood, an armoured offensive aimed at driving the Germans from the high ground to the south of Caen. The offensive ends 2 days later with minimal gains.', 'Hideki Tōjō resigns as Prime Minister of Japan due to numerous setbacks in the war effort and is succeeded on July 22 by Kuniaki Koiso.', 'July 20\nWWII: Adolf Hitler survives the 20 July plot to assassinate him led by Claus von Stauffenberg; he and his fellow conspirators in this and Operation Valkyrie are executed the following day.\nThe annular solar eclipse of July 20, 1944 is visible in Africa, Indian Ocean, Asia, Pacific Ocean and Australia, and is the 35th solar eclipse of Solar Saros 135.', 'WWII: Adolf Hitler survives the 20 July plot to assassinate him led by Claus von Stauffenberg; he and his fellow conspirators in this and Operation Valkyrie are executed the following day.', 'The annular solar eclipse of July 20, 1944 is visible in Africa, Indian Ocean, Asia, Pacific Ocean and Australia, and is the 35th solar eclipse of Solar Saros 135.', 'July 21 – WWII:\nBattle of Guam: American troops land on Guam (the battle ends August 10).\nThe Soviet-sponsored Polish Committee of National Liberation is created, in opposition to the Polish government-in-exile.', 'Battle of Guam: American troops land on Guam (the battle ends August 10).', 'The Soviet-sponsored Polish Committee of National Liberation is created, in opposition to the Polish government-in-exile.', 'July 22\nThe Bretton Woods Conference ends with agreements signed to set up the International Bank for Reconstruction and Development, General Agreement on Tariffs and Trade and International Monetary Fund.\nThe new Polish Committee of National Liberation publishes the PKWN Manifesto in Chełm, calling for a continuation of fighting against Nazi Germany, radical reforms including nationalisation of industry, and a ""decent border in the West"" (the Oder–Neisse line).\nUnited States v. Masaaki Kuwabara, the only Japanese American draft avoidance case to be dismissed on a due process violation of the U.S. Constitution.', 'The Bretton Woods Conference ends with agreements signed to set up the International Bank for Reconstruction and Development, General Agreement on Tariffs and Trade and International Monetary Fund.', 'The new Polish Committee of National Liberation publishes the PKWN Manifesto in Chełm, calling for a continuation of fighting against Nazi Germany, radical reforms including nationalisation of industry, and a ""decent border in the West"" (the Oder–Neisse line).', 'United States v. Masaaki Kuwabara, the only Japanese American draft avoidance case to be dismissed on a due process violation of the U.S. Constitution.', 'July 24 – The Holocaust: Majdanek concentration camp is liberated by the Soviet Red Army and much incriminating evidence of the atrocities committed there is found.', 'July 25 – WWII:\nOperation Spring: One of the bloodiest days for Canadian forces during the war results in 1,550 casualties, including 450 killed, during the Normandy Campaign.\nBattle of Tannenberg Line (or ""Battle of the Blue Hills"") in northeastern Estonia begins: The Red Army will gain a Pyrrhic victory by August 10.', 'Operation Spring: One of the bloodiest days for Canadian forces during the war results in 1,550 casualties, including 450 killed, during the Normandy Campaign.', 'Battle of Tannenberg Line (or ""Battle of the Blue Hills"") in northeastern Estonia begins: The Red Army will gain a Pyrrhic victory by August 10.', 'July 26 – WWII: A Messerschmitt Me 262 becomes the first jet fighter aircraft to have an operational victory.', 'July 31 – WWII: American submarine USS\xa0Parche torpedoes Japanese troop transport Yoshino Maru; 2,495 drown.']"
8,"['August 1 – WWII: The Warsaw Uprising begins.', ""August 2 – WWII:\nTurkey ends diplomatic and economic relations with Germany.\nThe First Assembly of ASNOM (the Anti-Fascist Assembly for the People's Liberation of Macedonia) is held in the Prohor Pčinjski monastery."", 'Turkey ends diplomatic and economic relations with Germany.', ""The First Assembly of ASNOM (the Anti-Fascist Assembly for the People's Liberation of Macedonia) is held in the Prohor Pčinjski monastery."", 'August 3 – The Education Act in the United Kingdom, promoted by Rab Butler, creates a Tripartite system of education in England, Wales and Northern Ireland.', ""August 4 – WWII:\nThe Holocaust: A tip from a Dutch informer leads the Gestapo to a sealed-off area in an Amsterdam warehouse, where they find Jewish diarist Anne Frank, her family, and others in hiding. All will die in captivity, except for Otto Frank, Anne's father.\nThe Finnish Parliament, by derogation, elects Marshal C. G. E. Mannerheim as President of Finland to replace Risto Ryti, who has resigned."", ""The Holocaust: A tip from a Dutch informer leads the Gestapo to a sealed-off area in an Amsterdam warehouse, where they find Jewish diarist Anne Frank, her family, and others in hiding. All will die in captivity, except for Otto Frank, Anne's father."", 'The Finnish Parliament, by derogation, elects Marshal C. G. E. Mannerheim as President of Finland to replace Risto Ryti, who has resigned.', 'August 5 – WWII:\nThe Warsaw Uprising:\nThe Wola massacre begins. Between now and August 12, 40,000 to 50,000 Polish civilians will be indiscriminately massacred by occupying SS troops.\nThe Holocaust: Polish insurgents liberate a German labor camp in Warsaw, freeing 348 Jewish prisoners.\nCowra breakout: Over 500 Japanese prisoners of war attempt a mass breakout from the Cowra camp in Australia. In the ensuing manhunt, 231 Japanese escapees and four Australian soldiers are killed.', 'The Warsaw Uprising:\nThe Wola massacre begins. Between now and August 12, 40,000 to 50,000 Polish civilians will be indiscriminately massacred by occupying SS troops.\nThe Holocaust: Polish insurgents liberate a German labor camp in Warsaw, freeing 348 Jewish prisoners.', 'The Wola massacre begins. Between now and August 12, 40,000 to 50,000 Polish civilians will be indiscriminately massacred by occupying SS troops.', 'The Holocaust: Polish insurgents liberate a German labor camp in Warsaw, freeing 348 Jewish prisoners.', 'Cowra breakout: Over 500 Japanese prisoners of war attempt a mass breakout from the Cowra camp in Australia. In the ensuing manhunt, 231 Japanese escapees and four Australian soldiers are killed.', 'August 7 – IBM dedicates the first program-controlled calculator, the Automatic Sequence Controlled Calculator (known best as the Harvard Mark I).', 'August 9 – The United States Forest Service and the Wartime Advertising Council release the first posters featuring Smokey Bear.', ""August 12 – WWII:\nThe Allies capture Florence, Italy.\nOperation Pluto: The world's first undersea oil pipeline is laid between England and France."", 'The Allies capture Florence, Italy.', ""Operation Pluto: The world's first undersea oil pipeline is laid between England and France."", 'August 15 – WWII: Operation Dragoon lands Allies in southern France. The U.S. 45th Infantry Division participates in its fourth assault landing at Sainte-Maxime, spearheading the drive for the Belfort Gap.', 'August 18 – WWII: American submarine USS\xa0Rasher sinks Teia Maru, Eishin Maru, Teiyu Maru, and aircraft carrier Taiyō from Japanese convoy HI71, in one of the most effective American ""wolfpack"" attacks of the war.', 'August 19 – WWII:\nAmerican submarine USS\xa0Spadefish torpedoes Japanese landing craft depot ship Tamatsu Maru; more than 4,400 Japanese servicemen drown.\nLiberation of Paris starts with resistance forces staging an insurrection against the German occupiers.', 'American submarine USS\xa0Spadefish torpedoes Japanese landing craft depot ship Tamatsu Maru; more than 4,400 Japanese servicemen drown.', 'Liberation of Paris starts with resistance forces staging an insurrection against the German occupiers.', 'August 20 – WWII:\nAmerican forces successfully defeat Nazi forces at Chambois, closing the Falaise Pocket.\n168 captured Allied airmen, including Phil Lamason, accused of being ""terror fliers"" by the Gestapo, arrive at Buchenwald concentration camp, where they form the KLB Club.', 'American forces successfully defeat Nazi forces at Chambois, closing the Falaise Pocket.', '168 captured Allied airmen, including Phil Lamason, accused of being ""terror fliers"" by the Gestapo, arrive at Buchenwald concentration camp, where they form the KLB Club.', 'August 21\nThe Dumbarton Oaks Conference (Washington Conversations on International Peace and Security Organization) opens in Washington, D.C.: U.S., British, Chinese, French and Soviet representatives meet to plan the foundation of the United Nations.\nWWII: Operation Tractable concludes, when Canadian troops relieve the Polish and link with the Americans, capturing remaining German forces in the Falaise Pocket, and securing the strategically important French town of Falaise, in the final offensive of the Battle of Normandy.', 'The Dumbarton Oaks Conference (Washington Conversations on International Peace and Security Organization) opens in Washington, D.C.: U.S., British, Chinese, French and Soviet representatives meet to plan the foundation of the United Nations.', 'WWII: Operation Tractable concludes, when Canadian troops relieve the Polish and link with the Americans, capturing remaining German forces in the Falaise Pocket, and securing the strategically important French town of Falaise, in the final offensive of the Battle of Normandy.', 'August 22 – WWII:\nTsushima Maru, an unmarked Japanese passenger/cargo ship, is sunk by torpedoes launched by the submarine USS\xa0Bowfin off Akuseki-jima, killing 1,484 civilians, including 767 schoolchildren.\nHolocaust of Kedros: German Wehrmacht infantry begin an intimidatory razing operation, killing 164, against the civilian residents of nine villages in the Amari Valley on the occupied Greek island of Crete.', 'Tsushima Maru, an unmarked Japanese passenger/cargo ship, is sunk by torpedoes launched by the submarine USS\xa0Bowfin off Akuseki-jima, killing 1,484 civilians, including 767 schoolchildren.', 'Holocaust of Kedros: German Wehrmacht infantry begin an intimidatory razing operation, killing 164, against the civilian residents of nine villages in the Amari Valley on the occupied Greek island of Crete.', 'August 23 – WWII:\nKing Michael\'s Coup: Ion Antonescu, the Conducator of Romania and Mihai Antonescu prime minister of Romania, are arrested and a new military government established. Romania leaves the war against the Soviet Union, joining the Allies. General Constantin Sanatescu is the ""armed force"" of the coup d\'état and will be appointed by King Michael of Romania as prime minister of Romania on September 1.\nPadule di Fucecchio massacre: At least 174 Italian civilians are killed by members of the 23rd Infantry Division (Wehrmacht) as a reprisal for the wounding of two soldiers.', 'King Michael\'s Coup: Ion Antonescu, the Conducator of Romania and Mihai Antonescu prime minister of Romania, are arrested and a new military government established. Romania leaves the war against the Soviet Union, joining the Allies. General Constantin Sanatescu is the ""armed force"" of the coup d\'état and will be appointed by King Michael of Romania as prime minister of Romania on September 1.', 'Padule di Fucecchio massacre: At least 174 Italian civilians are killed by members of the 23rd Infantry Division (Wehrmacht) as a reprisal for the wounding of two soldiers.', 'August 24 – WWII:\nLiberation of Paris: The Allies enter Paris, successfully completing Operation Overlord.\nJapanese vessels attack and sink the submarine USS\xa0Harder off Luzon.', 'Liberation of Paris: The Allies enter Paris, successfully completing Operation Overlord.', 'Japanese vessels attack and sink the submarine USS\xa0Harder off Luzon.', ""August 25 – WWII:\nGerman surrender of Paris: General Dietrich von Choltitz surrenders Paris to the Allies, in defiance of Hitler's orders to destroy it.\nMaillé massacre: 129 civilians (70% women and children) are massacred by the Gestapo at Maillé, Indre-et-Loire.\nHungary decides to continue the war together with Germany.\nThe Red Ball Express convoy system begins operation, supplying tons of materiel to Allied forces in France."", ""German surrender of Paris: General Dietrich von Choltitz surrenders Paris to the Allies, in defiance of Hitler's orders to destroy it."", 'Maillé massacre: 129 civilians (70% women and children) are massacred by the Gestapo at Maillé, Indre-et-Loire.', 'Hungary decides to continue the war together with Germany.', 'The Red Ball Express convoy system begins operation, supplying tons of materiel to Allied forces in France.', 'August 29 – WWII: The Slovak National Uprising against the Axis powers begins.', 'August 31 – The Mad Gasser of Mattoon apparently resumes his mysterious attacks in Mattoon, Illinois for two weeks.']"
9,"['September – The Dutch famine (""Hongerwinter"") begins, in the occupied northern part of the Netherlands.', 'September 1 – WWII: In Bulgaria, the Bagryanov government resigns.', 'September 2\nThe Holocaust: Diarist Anne Frank and her family are placed on the last transport train from Westerbork to Auschwitz concentration camp, arriving 3 days later.\n¡Hola! magazine is launched in Barcelona.\nThe last execution of a Finn in Finland will take place when soldier Olavi Laiho is executed by shooting in Oulu.', 'The Holocaust: Diarist Anne Frank and her family are placed on the last transport train from Westerbork to Auschwitz concentration camp, arriving 3 days later.', '¡Hola! magazine is launched in Barcelona.', 'The last execution of a Finn in Finland will take place when soldier Olavi Laiho is executed by shooting in Oulu.', 'September 3 – WWII: The Allies liberate Brussels.', 'September 4 – WWII:\nThe British 11th Armoured Division liberates the city of Antwerp, Belgium.\nFinland breaks off relations with Germany.', 'The British 11th Armoured Division liberates the city of Antwerp, Belgium.', 'Finland breaks off relations with Germany.', 'September 5\nWWII: The Soviet Union declares war on Bulgaria.\nBelgium, Netherlands and Luxembourg constitute Benelux.', 'WWII: The Soviet Union declares war on Bulgaria.', 'Belgium, Netherlands and Luxembourg constitute Benelux.', 'September 6 – WWII: The Tartu Offensive in Estonia concludes, with Soviet forces capturing Tartu.', ""September 7 – WWII:\nThe Belgian government in exile returns to Brussels from London.\nMembers of Vichy France's collaborationist government are relocated to Germany where an enclave is established for them in Sigmaringen Castle.\nShin'yō Maru incident: Japanese cargo ship SS\xa0Shinyō Maru is torpedoed and sunk in the Sulu Sea by American submarine USS Paddle while carrying 750 American prisoners of war; 688 perish."", 'The Belgian government in exile returns to Brussels from London.', ""Members of Vichy France's collaborationist government are relocated to Germany where an enclave is established for them in Sigmaringen Castle."", ""Shin'yō Maru incident: Japanese cargo ship SS\xa0Shinyō Maru is torpedoed and sunk in the Sulu Sea by American submarine USS Paddle while carrying 750 American prisoners of war; 688 perish."", 'September 8 – WWII:\nThe first V-2 rocket attack on London takes place.\nThe French town of Menton is liberated from German forces.\nBulgaria declares war on Germany.', 'The first V-2 rocket attack on London takes place.', 'The French town of Menton is liberated from German forces.', 'Bulgaria declares war on Germany.', 'September 9 – WWII: The Bulgarian government is overthrown by the Fatherland Front coalition, which establishes a pro-Soviet government.', 'September 10 – WWII: Liberation of Luxembourg.', 'September 11 – WWII:\nThe Laksevåg floating dry dock at Bergen (Norway) is sunk by British X-class submarine X-24.\nAn approaching formation of 36 US bombers is engaged by a German fighter squadron (Jagdgeschwader) in the Battle over the Ore Mountains. After the first German attack on the bombers, US Mustangs attack the German squadron in aerial dogfights.', 'The Laksevåg floating dry dock at Bergen (Norway) is sunk by British X-class submarine X-24.', 'An approaching formation of 36 US bombers is engaged by a German fighter squadron (Jagdgeschwader) in the Battle over the Ore Mountains. After the first German attack on the bombers, US Mustangs attack the German squadron in aerial dogfights.', 'September 12 – WWII: Allied forces from Operation Overlord (in northern France) and Operation Dragoon (in the south) link up near Dijon.', ""September 13 – WWII: The Battle of Meligalas begins, between the Greek Resistance forces of the Greek People's Liberation Army (ELAS) and the collaborationist Security Battalions."", 'September 14 – The Great Atlantic hurricane makes landfall in the New York City area.', 'September 15 – WWII: The Battle of Peleliu begins in the Pacific.', 'September 17 – WWII: Operation Market Garden: Allied airborne landings begin in the Netherlands and Germany.', 'September 17–20 – WWII: Italian Campaign – In the Battle of San Marino, British and Empire forces take the occupied neutral republic of San Marino from the German Army.', 'September 18 – WWII:\nBritish submarine HMS\xa0Tradewind torpedoes Japanese ""hell ship"" Jun\'yō Maru; 5,620 drown.\nAfter German forces declare the evacuation of Estonia the day before, the Estonian national government briefly resumes control of Tallinn before the Soviet advance.', 'British submarine HMS\xa0Tradewind torpedoes Japanese ""hell ship"" Jun\'yō Maru; 5,620 drown.', 'After German forces declare the evacuation of Estonia the day before, the Estonian national government briefly resumes control of Tallinn before the Soviet advance.', 'September 19 – WWII:\nAn armistice between Finland and the Soviet Union is signed, ending the Continuation War.\nThe Battle of Hürtgen Forest begins, east of the Belgian–German border.', 'An armistice between Finland and the Soviet Union is signed, ending the Continuation War.', 'The Battle of Hürtgen Forest begins, east of the Belgian–German border.', 'September 22 – WWII: The Red Army captures Tallinn, Estonia. Prime Minister in Duties of the President of Estonia Jüri Uluots and 80,000 Estonian civilians manage to escape to Sweden and Germany. The evacuees include almost the entire population of Estonian Swedes. Soviet bombing raids on the evacuating ships sink several, with thousands on board.', 'September 24 – WWII: The U.S. 45th Infantry Division takes the strongly defended city of Épinal in France before crossing the Moselle River and entering the western foothills of the Vosges.', 'September 26 – WWII:\nOperation Market Garden ends in an Allied withdrawal.\nOn the middle front of the Gothic Line, Brazilian troops control the Serchio valley region after 10 days of fighting.', 'Operation Market Garden ends in an Allied withdrawal.', 'On the middle front of the Gothic Line, Brazilian troops control the Serchio valley region after 10 days of fighting.']"
