Month No.,Month-Day(s)-Events10,"['October 2 – WWII: Nazi troops end the Warsaw Uprising. This is followed by the Destruction of Warsaw.', ""October 4 – WWII: Milan Nedić's collaborationist puppet government of the Axis powers, the Government of National Salvation in Nazi-occupied Serbia, is disbanded."", 'October 5 – WWII: Royal Canadian Air Force pilots shoot down the first German Me 262 over the Netherlands.', 'October 6\nWWII: The Battle of Debrecen starts on the Eastern Front, lasting until October 29.\nMilan Nedić, president of the Serbian collaborationist puppet state of the Axis powers, the Government of National Salvation, flees from Belgrade in Nazi-occupied Serbia by air together with other Serbian collaborators and German officials, via Hungary to Austria.\nThe Holocaust: Members of the Sonderkommando (Jewish work units) in Auschwitz concentration camp stage a revolt, killing 3 SS men before being massacred themselves.\nThe Dumbarton Oaks Conference concludes.', 'WWII: The Battle of Debrecen starts on the Eastern Front, lasting until October 29.', 'Milan Nedić, president of the Serbian collaborationist puppet state of the Axis powers, the Government of National Salvation, flees from Belgrade in Nazi-occupied Serbia by air together with other Serbian collaborators and German officials, via Hungary to Austria.', 'The Holocaust: Members of the Sonderkommando (Jewish work units) in Auschwitz concentration camp stage a revolt, killing 3 SS men before being massacred themselves.', 'The Dumbarton Oaks Conference concludes.', 'October 8 – The Adventures of Ozzie and Harriet radio show debuts in the United States.', 'October 9 – WWII: Fourth Moscow Conference: British Prime Minister Winston Churchill and Soviet Premier Joseph Stalin begin a 9-day conference in Moscow, to discuss the future of Europe.', 'October 10\nThe Holocaust/Porajmos: 800 Romani children are systematically murdered at the Auschwitz concentration camp.\nWWII: 10/10 Air Raid: Allied forces inflict significant losses upon Imperial Japanese Navy ships moored in Naha Harbor, destroying much of the city of Naha, Okinawa as well..', 'The Holocaust/Porajmos: 800 Romani children are systematically murdered at the Auschwitz concentration camp.', 'WWII: 10/10 Air Raid: Allied forces inflict significant losses upon Imperial Japanese Navy ships moored in Naha Harbor, destroying much of the city of Naha, Okinawa as well..', ""October 11 – The Tuvan People's Republic is annexed into the Soviet Union."", 'October 12\nWWII: The Allies land in Athens.\nCanadian Arctic explorer Henry Larsen returns to Vancouver, becoming the first person successfully to navigate the Northwest Passage in both directions, in the Royal Canadian Mounted Police schooner St. Roch. His westbound voyage is the first completed in a single season, and the first passage through the Prince of Wales Strait.', 'WWII: The Allies land in Athens.', 'Canadian Arctic explorer Henry Larsen returns to Vancouver, becoming the first person successfully to navigate the Northwest Passage in both directions, in the Royal Canadian Mounted Police schooner St. Roch. His westbound voyage is the first completed in a single season, and the first passage through the Prince of Wales Strait.', 'October 13 – WWII:\nRiga, the capital of Latvia, is taken by the Red Army.\nThe first V-2 rocket attack on Antwerp takes place.', 'Riga, the capital of Latvia, is taken by the Red Army.', 'The first V-2 rocket attack on Antwerp takes place.', 'October 14 – WWII: German Field Marshal Erwin Rommel commits forced suicide rather than face public disgrace and execution for allegedly conspiring against Adolf Hitler.', ""October 16 – WWII: American bombing of Salzburg destroys the dome of the city's cathedral and most of a Mozart family home."", ""October 18 – WWII: The Volkssturm Nazi militia is founded, on Adolf Hitler's orders."", 'October 19 – The Guatemalan Revolution begins with the overthrow of Federico Ponce Vaides by a popular leftist movement.', ""October 20 – WWII:\nBelgrade Offensive ends when Belgrade is liberated by Yugoslav Partisans, together with the Bulgarian Army and the Red Army, and the remnants of Nedić's collaborationist Serbian puppet state, the Government of National Salvation, are abolished.\nAmerican and Filipino troops (with Filipino guerrillas) begin the Battle of Leyte in the Philippines. American forces land on Red Beach in Palo, Leyte, as General Douglas MacArthur returns to the Philippines with Philippine Commonwealth president Sergio Osmeña and Armed Forces of the Philippines Generals Basilio J. Valdes and Carlos P. Romulo. American forces land on the beaches in Dulag, Leyte, accompanied by Filipino troops entering the town, and fiercely opposed by the Japanese occupation forces. The combined forces liberate Tacloban.\nOperation Pheasant begins – an offensive in the Netherlands which supports the ongoing Battle of the Scheldt."", ""Belgrade Offensive ends when Belgrade is liberated by Yugoslav Partisans, together with the Bulgarian Army and the Red Army, and the remnants of Nedić's collaborationist Serbian puppet state, the Government of National Salvation, are abolished."", 'American and Filipino troops (with Filipino guerrillas) begin the Battle of Leyte in the Philippines. American forces land on Red Beach in Palo, Leyte, as General Douglas MacArthur returns to the Philippines with Philippine Commonwealth president Sergio Osmeña and Armed Forces of the Philippines Generals Basilio J. Valdes and Carlos P. Romulo. American forces land on the beaches in Dulag, Leyte, accompanied by Filipino troops entering the town, and fiercely opposed by the Japanese occupation forces. The combined forces liberate Tacloban.', 'Operation Pheasant begins – an offensive in the Netherlands which supports the ongoing Battle of the Scheldt.', 'October 21 – WWII: Aachen, the first German city to fall, is captured by American troops.', 'October 23–26 – WWII: Naval Battle of Leyte Gulf in the Philippines – In the largest naval battle in history by most criteria and the last naval battle in history between battleships, combined United States and Australian naval forces decisively defeat the Imperial Japanese Navy. This is the first battle in which Japanese aircraft carry out organized kamikaze attacks.', ""October 24\nBattle of Leyte Gulf: The Japanese battleship\xa0Musashi is sunk by United States aircraft.\nThe Allies recognise Charles de Gaulle's cabinet as the provisional government of France."", 'Battle of Leyte Gulf: The Japanese battleship\xa0Musashi is sunk by United States aircraft.', ""The Allies recognise Charles de Gaulle's cabinet as the provisional government of France."", 'October 25\nWWII: The Red Army liberates Kirkenes, the first town in Norway to be liberated.\nWWII: USS\xa0Tang is sunk in the Formosa Strait by one of her own torpedoes. Medal of Honor-winning submarine ace Richard O\'Kane becomes a prisoner of war.\n76-year-old American amateur soprano Florence Foster Jenkins gives a sell-out public recital in Carnegie Hall, New York. The audience and press are scathing: ""she can sing everything except notes"". 5 days later she suffers a fatal heart attack, dying at home on November 26.', 'WWII: The Red Army liberates Kirkenes, the first town in Norway to be liberated.', ""WWII: USS\xa0Tang is sunk in the Formosa Strait by one of her own torpedoes. Medal of Honor-winning submarine ace Richard O'Kane becomes a prisoner of war."", '76-year-old American amateur soprano Florence Foster Jenkins gives a sell-out public recital in Carnegie Hall, New York. The audience and press are scathing: ""she can sing everything except notes"". 5 days later she suffers a fatal heart attack, dying at home on November 26.', 'October 27 – WWII: German forces capture Banská Bystrica, the center of anti-Nazi opposition in Slovakia, bringing the Slovak National Uprising to an end.', 'October 30\nThe Holocaust: Anne Frank and her sister Margot are deported from Auschwitz to the Bergen-Belsen concentration camp.\nAppalachian Spring, a ballet by Martha Graham with music by Aaron Copland, debuts at the Library of Congress in Washington, D.C., with Graham in the lead role.', 'The Holocaust: Anne Frank and her sister Margot are deported from Auschwitz to the Bergen-Belsen concentration camp.', 'Appalachian Spring, a ballet by Martha Graham with music by Aaron Copland, debuts at the Library of Congress in Washington, D.C., with Graham in the lead role.', 'October 31 – Serial killer Dr Marcel Petiot is apprehended at a Paris Métro station after 7 months on the run.']"
11,"['November 1–December 7 – Delegates of 52 nations meet at the International Civil Aviation Conference in Chicago, to plan for postwar international cooperation, framing the constitution of the International Civil Aviation Organization.', 'November 3 – WWII: Two supreme commanders of the Slovak National Uprising, Generals Ján Golian and Rudolf Viest, are captured, tortured and later executed by German forces.', 'November 7\n1944 United States presidential election: Franklin D. Roosevelt wins reelection over Republican challenger Thomas E. Dewey, becoming the only U.S. president elected to a fourth term.\nElection day rail accident in Puerto Rico: A passenger train derails at Aguadilla due to excessive speed on a downgrade; 16 are killed, 50 injured.', '1944 United States presidential election: Franklin D. Roosevelt wins reelection over Republican challenger Thomas E. Dewey, becoming the only U.S. president elected to a fourth term.', 'Election day rail accident in Puerto Rico: A passenger train derails at Aguadilla due to excessive speed on a downgrade; 16 are killed, 50 injured.', 'November 10 – WWII: Ammunition ship USS\xa0Mount Hood disintegrates from the accidental detonation of 3,800 tons of cargo, in the Seeadler Harbor fleet anchorage at Manus Island. 22 small boats are destroyed, 36 nearby ships damaged, 432 men are killed and 371 more are injured.', 'November 11 – Operational ships of the French Navy re-enter their base at Toulon.', 'November 12 – WWII: Operation Catechism – German battleship\xa0Tirpitz is sunk by British Royal Air Force Lancaster bombers near Tromsø. Estimated casualties range from 950 to 1,204.', 'November 14 – WWII:American submarine  USS\xa0Queenfish torpedoes Japanese aircraft carrier Akitsu Maru in the East China Sea; 2,246 drown.', 'November 16 – WWII: U.S. forces begin the month-long Operation Queen in the Rur Valley.', 'November 18\nThe Popular Socialist Youth is founded in Cuba.\nWWII: American submarine USS\xa0Picuda torpedoes Japanese landing craft depot ship Mayasan Maru; 3,546 drown.', 'The Popular Socialist Youth is founded in Cuba.', 'WWII: American submarine USS\xa0Picuda torpedoes Japanese landing craft depot ship Mayasan Maru; 3,546 drown.', ""November 22\nConscription Crisis: Prime Minister of Canada William Mackenzie King agrees a one-time conscription levy in Canada for overseas service.\nLaurence Olivier's film Henry V, based on Shakespeare's play, opens in London. It is the most acclaimed and the most successful movie version of a Shakespeare play made up to this time, and the first in Technicolor. Olivier both stars and directs."", 'Conscription Crisis: Prime Minister of Canada William Mackenzie King agrees a one-time conscription levy in Canada for overseas service.', ""Laurence Olivier's film Henry V, based on Shakespeare's play, opens in London. It is the most acclaimed and the most successful movie version of a Shakespeare play made up to this time, and the first in Technicolor. Olivier both stars and directs."", 'November 24 – WWII: German forces evacuate from the West Estonian Archipelago.', 'November 27\nRAF Fauld explosion: Between 3,450 and 3,930 tons (3,500 and 4,000 tonnes) of ordnance explodes at an underground storage depot in Staffordshire, England, leaving about 75 dead and a crater 1,200 metres (1,300\xa0yd) across and 120 metres (390\xa0ft) deep. The blast is one of the largest non-nuclear explosions in history, and the largest on UK soil.\nOperation Tigerfish: Royal Air Force bombing of Freiburg im Breisgau kills 2,800.', 'RAF Fauld explosion: Between 3,450 and 3,930 tons (3,500 and 4,000 tonnes) of ordnance explodes at an underground storage depot in Staffordshire, England, leaving about 75 dead and a crater 1,200 metres (1,300\xa0yd) across and 120 metres (390\xa0ft) deep. The blast is one of the largest non-nuclear explosions in history, and the largest on UK soil.', 'Operation Tigerfish: Royal Air Force bombing of Freiburg im Breisgau kills 2,800.', 'November 29 – WWII: American submarine USS\xa0Archerfish sinks Japanese aircraft carrier Shinano, the largest carrier built to this date, and will remain through the twentieth century the largest ship sunk by a submarine.']"
12,"['December 1 – Edward Stettinius, Jr. becomes the last United States Secretary of State of the Roosevelt administration, filling the seat left by Cordell Hull.', 'December 3 – WWII:\nFighting breaks out between Communists and royalists in newly liberated Greece, eventually leading to a full-scale Greek Civil War.\nThe Home Guard (United Kingdom) is stood down.', 'Fighting breaks out between Communists and royalists in newly liberated Greece, eventually leading to a full-scale Greek Civil War.', 'The Home Guard (United Kingdom) is stood down.', ""December 7\nThe Convention on International Civil Aviation is signed in Chicago, creating the International Civil Aviation Organization.\nThe Arab Women's Congress of 1944 is hosted by the Egyptian Feminist Union in Cairo, leading to establishment of the Arab Feminist Union.\nAn earthquake along the coast of Wakayama Prefecture in Japan causes a tsunami which kills 1223 people."", 'The Convention on International Civil Aviation is signed in Chicago, creating the International Civil Aviation Organization.', ""The Arab Women's Congress of 1944 is hosted by the Egyptian Feminist Union in Cairo, leading to establishment of the Arab Feminist Union."", 'An earthquake along the coast of Wakayama Prefecture in Japan causes a tsunami which kills 1223 people.', ""December 10 – Italian conductor Arturo Toscanini leads a concert performance of the first half of Beethoven's Fidelio (minus its spoken dialogue) on NBC Radio, starring Rose Bampton. He chooses this opera for its political message: a statement against tyranny and dictatorship. Presenting it in German, Toscanini intends it as a tribute to the German people who are being oppressed by Hitler. The second half is broadcast a week later. The performance is later released on LP and CD, the first of 7 operas that Toscanini conducts on radio."", 'December 12–13 – WWII: British units attempt to take the Italian hilltop town of Tossignano, but are repulsed.', 'December 13 – WWII: Battle of Mindoro – United States, Australian and Philippine Commonwealth troops land on Mindoro Island in the Philippines.', 'December 14\nThe Soviet government changes Turkish place names to Russian in the Crimea.\nThe film National Velvet is released in the United States, bringing a young Elizabeth Taylor to stardom.', 'The Soviet government changes Turkish place names to Russian in the Crimea.', 'The film National Velvet is released in the United States, bringing a young Elizabeth Taylor to stardom.', 'December 15 – A USAAF utility aircraft carrying bandleader Major Glenn Miller disappears in heavy fog over the English Channel, while flying to Paris.', 'December 16 – WWII:\nGermany begins the Ardennes offensive, later known as the Battle of the Bulge.\nGeneral George C. Marshall becomes the first U.S. Five-Star General.', 'Germany begins the Ardennes offensive, later known as the Battle of the Bulge.', 'General George C. Marshall becomes the first U.S. Five-Star General.', 'December 17 – WWII:\nMalmedy massacre: German SS troops under Joachim Peiper machine gun American prisoners of war captured during the Battle of the Bulge near Malmedy, and elsewhere in Belgium.\nBombing of Ulm: 707 people are killed and 25,000 left homeless.', 'Malmedy massacre: German SS troops under Joachim Peiper machine gun American prisoners of war captured during the Battle of the Bulge near Malmedy, and elsewhere in Belgium.', 'Bombing of Ulm: 707 people are killed and 25,000 left homeless.', 'December 18 – General Douglas MacArthur becomes the second U.S. Five-Star General.', 'December 19 – The daily newspaper Le Monde begins publication in Paris.', 'December 20\nThe United States Women Airforce Service Pilots are disbanded.\nGeneral Dwight D. Eisenhower is promoted to the rank of 5-star U.S. Five-Star General.', 'The United States Women Airforce Service Pilots are disbanded.', 'General Dwight D. Eisenhower is promoted to the rank of 5-star U.S. Five-Star General.', 'December 22\nWWII: Brigadier General Anthony C. McAuliffe, commander of the U.S. forces defending Bastogne, refuses to accept demands for surrender by sending a one-word reply, ""Nuts!"", to the German command.\nThe Vietnam People\'s Army is formed in French Indochina.', 'WWII: Brigadier General Anthony C. McAuliffe, commander of the U.S. forces defending Bastogne, refuses to accept demands for surrender by sending a one-word reply, ""Nuts!"", to the German command.', ""The Vietnam People's Army is formed in French Indochina."", ""December 24\nWWII: Troopship SS\xa0Léopoldville is sunk in the English Channel by German submarine\xa0U-486. Approximately 763 soldiers of the U.S. 66th Infantry Division, bound for the Battle of the Bulge, drown.\nWWII: German tanks reach the furthest point of the Bulge at Celles.\nWWII: Fifty German V-1 flying bombs, air-launched from Heinkel He 111 bombers flying over the North Sea, target Manchester in England, killing 42 and injuring more than 100 in the Oldham area.\nWWII: Bande massacre: 34 men between the ages of 17 and 32 are executed by the Sicherheitsdienst near Bande, Belgium, in retaliation for the killing of 3 German soldiers.\nThe first complete U.S. production of Tchaikovsky's ballet The Nutcracker is presented in San Francisco, choreographed by Willam Christensen. It will become an annual tradition there, and for the next ten years, the San Francisco Ballet will be the only company in the United States performing the complete work."", 'WWII: Troopship SS\xa0Léopoldville is sunk in the English Channel by German submarine\xa0U-486. Approximately 763 soldiers of the U.S. 66th Infantry Division, bound for the Battle of the Bulge, drown.', 'WWII: German tanks reach the furthest point of the Bulge at Celles.', 'WWII: Fifty German V-1 flying bombs, air-launched from Heinkel He 111 bombers flying over the North Sea, target Manchester in England, killing 42 and injuring more than 100 in the Oldham area.', 'WWII: Bande massacre: 34 men between the ages of 17 and 32 are executed by the Sicherheitsdienst near Bande, Belgium, in retaliation for the killing of 3 German soldiers.', ""The first complete U.S. production of Tchaikovsky's ballet The Nutcracker is presented in San Francisco, choreographed by Willam Christensen. It will become an annual tradition there, and for the next ten years, the San Francisco Ballet will be the only company in the United States performing the complete work."", 'December 24–26 – Agana race riot in Guam between white and black United States Marines.', 'December 26\nWWII: American troops repulse German forces at Bastogne.\nThe original stage version of The Glass Menagerie by Tennessee Williams premieres in Chicago.\nEsztergom, Hungary, is captured by the Russians.', 'WWII: American troops repulse German forces at Bastogne.', 'The original stage version of The Glass Menagerie by Tennessee Williams premieres in Chicago.', 'Esztergom, Hungary, is captured by the Russians.', 'December 30\nKing George II of Greece declares a regency, leaving his throne vacant.\nStage Door Cartoon is the first cartoon produced by Eddie Selzer.', 'King George II of Greece declares a regency, leaving his throne vacant.', 'Stage Door Cartoon is the first cartoon produced by Eddie Selzer.', 'December 31 – WWII: Battle of Leyte – Tens of thousands of Imperial Japanese Army soldiers are killed in action, in a significant Filipino/Allied military victory.']"
13,"[""The 1944 Summer Olympics, scheduled for London (together with the February Winter Olympics scheduled for Cortina d'Ampezzo in Italy), are suspended due to WWII."", 'National Committee for Education on Alcoholism, predecessor of the National Council on Alcoholism and Drug Dependence, is established in the United States by Marty Mann.', 'Last known evidence of the existence of the Asiatic lion in the wild in Khuzestan Province, Persia.', 'The BC Žalgiris professional basketball club is founded in Kaunas, Lithuanian Soviet Socialist Republic.']"
