Month No.,Month-Day(s)-Events7,"['November 1 – A trolleybus plunges into the Nile at Cairo, Egypt, killing 74 passengers.', 'November 3 – French President Charles de Gaulle announces (just short of his 75th birthday) that he will stand for re-election.', 'November 5 – Martial law is announced in Rhodesia. The United Nations General Assembly accepts British intent to use force against Rhodesia if necessary by a vote of 82–9.', 'November 6 – Freedom Flights begin: Cuba and the United States formally agree to start an airlift for Cubans who want to go to the United States (by 1971, 250,000 Cubans take advantage of this program).', 'November 8\nVietnam War – Operation Hump: The United States Army 173rd Airborne is ambushed by over 1,200 Viet Cong.', 'Vietnam War – Operation Hump: The United States Army 173rd Airborne is ambushed by over 1,200 Viet Cong.', ""November 11\nIn Rhodesia (modern-day Zimbabwe), the white-minority government of Ian Smith unilaterally declares de facto independence ('UDI').\nUnited Airlines Flight 227 crashes short of the runway and catches fire at Salt Lake City International Airport, killing 43 out of 91 passengers and crew."", ""In Rhodesia (modern-day Zimbabwe), the white-minority government of Ian Smith unilaterally declares de facto independence ('UDI')."", 'United Airlines Flight 227 crashes short of the runway and catches fire at Salt Lake City International Airport, killing 43 out of 91 passengers and crew.', 'November 12 – A UN Security Council resolution (voted 10–0) recommends that other countries not recognize independent Rhodesia.', 'November 13\nThe SS\xa0Yarmouth Castle burns and sinks 60 miles (97\xa0km) off Nassau, Bahamas, with the loss of 90 lives.\nBritish theatre critic Kenneth Tynan says ""fuck"" during a discussion on BBC satirical programme BBC-3 for what many believed was the first time on British television. The corporation later issues a public apology.', 'The SS\xa0Yarmouth Castle burns and sinks 60 miles (97\xa0km) off Nassau, Bahamas, with the loss of 90 lives.', 'British theatre critic Kenneth Tynan says ""fuck"" during a discussion on BBC satirical programme BBC-3 for what many believed was the first time on British television. The corporation later issues a public apology.', 'November 14 – Vietnam War – Battle of Ia Drang: In the Ia Drang Valley of the Central Highlands in Vietnam, the first major engagement of the war between regular United States and North Vietnamese forces begins.', 'November 15 – U.S. racer Craig Breedlove sets a new land speed record of 600.601\xa0mph (966.574\xa0km/h).', 'November 16 – Venera program: The Soviet Union launches the Venera 3 space probe from Baikonur, Kazakhstan toward Venus (on March 1, 1966, it becomes the first spacecraft to reach the surface of another planet).', 'November 20 – The United Nations Security Council recommends that all states stop trading with Rhodesia.', 'November 22 – The United Nations Development Programme (UNDP) is established as a specialized agency of the United Nations.', 'November 23 – Soviet general Mikhail Kazakov assumes command of the Warsaw Pact.', 'November 24 – Congolese lieutenant general Mobutu ousts Joseph Kasavubu and declares himself president.', 'November 26 – At the Hammaguir launch facility in the Sahara Desert, France launches a Diamant A rocket with its first satellite, Astérix-1 on board, becoming the third country to enter outer space.', 'November 27\nTens of thousands of Vietnam War protesters picket the White House, then march on the Washington Monument.\nVietnam War: The Pentagon tells U.S. President Lyndon B. Johnson that if planned major sweep operations to neutralize Viet Cong forces during the next year are to succeed, the number of American troops in Vietnam will have to be increased from 120,000 to 400,000.', 'Tens of thousands of Vietnam War protesters picket the White House, then march on the Washington Monument.', 'Vietnam War: The Pentagon tells U.S. President Lyndon B. Johnson that if planned major sweep operations to neutralize Viet Cong forces during the next year are to succeed, the number of American troops in Vietnam will have to be increased from 120,000 to 400,000.', 'November 28 – Vietnam War: In response to U.S. President Lyndon B. Johnson\'s call for ""more flags"" in Vietnam, Philippines President-elect Ferdinand Marcos announces he will send troops to help fight in South Vietnam.', 'November 29 – The Canadian satellite Alouette 2 is launched.']"
8,"['December 5\nCharles de Gaulle is re-elected as French president with 10,828,421 votes.\nThe ""Glasnost Meeting"" in Moscow becomes the first spontaneous political demonstration, and the first demonstration for civil rights in the Soviet Union.', 'Charles de Gaulle is re-elected as French president with 10,828,421 votes.', 'The ""Glasnost Meeting"" in Moscow becomes the first spontaneous political demonstration, and the first demonstration for civil rights in the Soviet Union.', 'December 8\nRhodesian prime minister Ian Smith warns that Rhodesia will resist a trade embargo by neighboring countries with force.\nThe Race Relations Act becomes the first legislation to address racial discrimination in the UK.\nThe Second Vatican Council closes.', 'Rhodesian prime minister Ian Smith warns that Rhodesia will resist a trade embargo by neighboring countries with force.', 'The Race Relations Act becomes the first legislation to address racial discrimination in the UK.', 'The Second Vatican Council closes.', 'December 15\nThe Caribbean Free Trade Association (CARIFTA) is formed.\nGemini 6 and Gemini 7 perform the first controlled rendezvous in Earth orbit.', 'The Caribbean Free Trade Association (CARIFTA) is formed.', 'Gemini 6 and Gemini 7 perform the first controlled rendezvous in Earth orbit.', 'December 20 – The World Food Programme is made a permanent agency of the United Nations.', 'December 21\nThe Soviet Union announces that it has shipped rockets to North Vietnam.\nIn West Germany, Konrad Adenauer resigns as chairman of the Christian Democratic Party.\nThe United Nations adopts the International Convention on the Elimination of All Forms of Racial Discrimination.\nA new 1-hour German-American production of the ballet The Nutcracker, with an international cast that includes Edward Villella in the title role, makes its U.S. television debut. It is repeated annually by CBS over the next 3 years but after that is virtually forgotten until issued on DVD in 2009 by Warner Archive.', 'The Soviet Union announces that it has shipped rockets to North Vietnam.', 'In West Germany, Konrad Adenauer resigns as chairman of the Christian Democratic Party.', 'The United Nations adopts the International Convention on the Elimination of All Forms of Racial Discrimination.', 'A new 1-hour German-American production of the ballet The Nutcracker, with an international cast that includes Edward Villella in the title role, makes its U.S. television debut. It is repeated annually by CBS over the next 3 years but after that is virtually forgotten until issued on DVD in 2009 by Warner Archive.', ""December 22\nA military coup is launched in Dahomey.\nA 70\xa0mph (110\xa0km/h) speed limit is imposed on British roads.\nDavid Lean's film of Doctor Zhivago, starring Omar Sharif and Julie Christie, is released."", 'A military coup is launched in Dahomey.', 'A 70\xa0mph (110\xa0km/h) speed limit is imposed on British roads.', ""David Lean's film of Doctor Zhivago, starring Omar Sharif and Julie Christie, is released."", ""December 25 – The Yemeni Nasserist Unionist People's Organisation is founded in Ta'izz."", 'December 30\nPresident Kenneth Kaunda of Zambia announces that Zambia and the United Kingdom have agreed on a deadline before which the Rhodesian white government should be ousted.\nFerdinand Marcos becomes President of the Philippines.', 'President Kenneth Kaunda of Zambia announces that Zambia and the United Kingdom have agreed on a deadline before which the Rhodesian white government should be ousted.', 'Ferdinand Marcos becomes President of the Philippines.', 'December 31 – Bokassa takes power in the Central African Republic.']"
9,"['Tokyo officially becomes the largest city of the world, taking the lead from New York City.', 'Aborigines are given the vote in Queensland, Australia.']"
10,"['January 4\nJulia Ormond, British actress\nYvan Attal, Israeli-born French actor and director', 'Julia Ormond, British actress', 'Yvan Attal, Israeli-born French actor and director', 'January 5\nVinnie Jones, British footballer-turned-actor\nPatrik Sjöberg, Swedish high jumper', 'Vinnie Jones, British footballer-turned-actor', 'Patrik Sjöberg, Swedish high jumper', 'January 9\nHaddaway, German singer\nFarah Khan, Indian choreographer, film director\nJoely Richardson, British actress', 'Haddaway, German singer', 'Farah Khan, Indian choreographer, film director', 'Joely Richardson, British actress', 'January 10 – Butch Hartman, American animator and voice actor', 'January 12\nNikolai Borschevsky, Russian ice hockey player\nMaybrit Illner, German television journalist and presenter\nRob Zombie, American musician', 'Nikolai Borschevsky, Russian ice hockey player', 'Maybrit Illner, German television journalist and presenter', 'Rob Zombie, American musician', 'January 13 – Bill Bailey, British comedian, musician and actor', 'January 14\nShamil Basayev, Chechen terrorist (d. 2006)\nMarc Delissen, Dutch field hockey player\nBob Essensa, Canadian ice hockey player', 'Shamil Basayev, Chechen terrorist (d. 2006)', 'Marc Delissen, Dutch field hockey player', 'Bob Essensa, Canadian ice hockey player', 'January 15\nAdam Jones, American musician, guitarist of metal band Tool\nJames Nesbitt, Northern Irish actor', 'Adam Jones, American musician, guitarist of metal band Tool', 'James Nesbitt, Northern Irish actor', 'January 20 – Sophie, Countess of Wessex, wife of Prince Edward, Earl of Wessex', 'January 21 – Jam Master Jay, American DJ, rapper and producer (d. 2002)', 'January 22\nDJ Jazzy Jeff, American disc jockey\nDiane Lane, American actress', 'DJ Jazzy Jeff, American disc jockey', 'Diane Lane, American actress', 'January 23 – Catherine Guillouard, French businesswoman', 'January 24 – Porfirio Fisac, Spanish basketball coach', 'January 25 – Esa Tikkanen, Finnish ice hockey player', 'January 26 – Natalia Yurchenko, Soviet artistic gymnast', 'January 27\nAlan Cumming, Scottish actor\nIgnacio Noé, Argentine artist', 'Alan Cumming, Scottish actor', 'Ignacio Noé, Argentine artist', 'January 29\nDominik Hašek, Czech hockey player\nJo Min-su, South Korean actress', 'Dominik Hašek, Czech hockey player', 'Jo Min-su, South Korean actress']"
11,"['February 1\nDave Callaghan, South African cricketer\nBrandon Lee, Chinese-American actor (d. 1993)\nSherilyn Fenn, American actress\nPrincess Stéphanie of Monaco', 'Dave Callaghan, South African cricketer', 'Brandon Lee, Chinese-American actor (d. 1993)', 'Sherilyn Fenn, American actress', 'Princess Stéphanie of Monaco', 'February 3\nMattanya Cohen, Israeli diplomat\nMaura Tierney, American actress', 'Mattanya Cohen, Israeli diplomat', 'Maura Tierney, American actress', 'February 5 – Gheorghe Hagi, Romanian footballer, manager and club owner', 'February 6\nIdania Martínez Grandales, Cuban broadcaster, journalist and professor\nJan Svěrák, Czech actor, director, and screenwriter', 'Idania Martínez Grandales, Cuban broadcaster, journalist and professor', 'Jan Svěrák, Czech actor, director, and screenwriter', 'February 7 – Chris Rock, African-American actor, comedian, and film director', 'February 8 – Dicky Cheung, Hong Kong actor', 'February 9 – Keith Wickham, British actor', 'February 11 – Roberto Moya, Cuban athlete (d. 2020)', 'February 12 – Brett Kavanaugh, American attorney and Supreme Court Justice', 'February 15 – Héctor Beltrán Leyva, Mexican drug lord (d. 2018)', 'February 16 – Adama Barrow, Gambian politician, 3rd President of Gambia', 'February 17 – Michael Bay, American film director', 'February 18 – Dr. Dre, African-American rapper and music producer', 'February 23\nKristin Davis, American actress\nMichael Dell, American computer manufacturer\nVincent Chalvon-Demersay, French producer', 'Kristin Davis, American actress', 'Michael Dell, American computer manufacturer', 'Vincent Chalvon-Demersay, French producer', 'February 25 – Sylvie Guillem, French ballerina', 'February 27 – Claudia Zobel, Filipina actress (d. 1984)', 'February 28 – Park Gok-ji, South Korean film editor']"
12,"['March 1\nMike Dean, Record producer\nStewart Elliott, Canadian jockey\nJack Tu, Taiwanese-Canadian cardiologist (d. 2018)', 'Mike Dean, Record producer', 'Stewart Elliott, Canadian jockey', 'Jack Tu, Taiwanese-Canadian cardiologist (d. 2018)', 'March 3\nTedros Adhanom, Director of the World Health Organization\nDragan Stojković, Serbian footballer and coach', 'Tedros Adhanom, Director of the World Health Organization', 'Dragan Stojković, Serbian footballer and coach', 'March 4\nGreg Alexander, Australian rugby league player\nPaul W. S. Anderson, British filmmaker, producer and screenwriter', 'Greg Alexander, Australian rugby league player', 'Paul W. S. Anderson, British filmmaker, producer and screenwriter', 'March 8\nMac Jack, South African educator and politician (d. 2020)\nCaio Júnior, Brazilian football forward and manager (d. 2016)', 'Mac Jack, South African educator and politician (d. 2020)', 'Caio Júnior, Brazilian football forward and manager (d. 2016)', 'March 9\nAntonio Saca, 43rd President of El Salvador\nMike Pollock, American voice actor', 'Antonio Saca, 43rd President of El Salvador', 'Mike Pollock, American voice actor', 'March 11\nCatherine Fulop, Venezuelan actress, model, beauty pageant contestant, and television presenter\nJesse Jackson Jr., African-American politician\nLaurence Llewelyn-Bowen, British designer and television presenter', 'Catherine Fulop, Venezuelan actress, model, beauty pageant contestant, and television presenter', 'Jesse Jackson Jr., African-American politician', 'Laurence Llewelyn-Bowen, British designer and television presenter', 'March 14 – Aamir Khan, Indian film director, producer, film and scriptwriter and actor', 'March 16\nUtut Adianto, Indonesian chess grandmaster and politician\nMark Carney, Canadian-born economist and central banker', 'Utut Adianto, Indonesian chess grandmaster and politician', 'Mark Carney, Canadian-born economist and central banker', 'March 23 – Marti Pellow, Scottish singer (Wet Wet Wet)', 'March 24\nRob MacCachren, American racecar driver\nThe Undertaker, American professional wrestler', 'Rob MacCachren, American racecar driver', 'The Undertaker, American professional wrestler', 'March 25\nStefka Kostadinova, Bulgarian high jumper and president of the Bulgarian Olympic Committee\nSarah Jessica Parker, American actress', 'Stefka Kostadinova, Bulgarian high jumper and president of the Bulgarian Olympic Committee', 'Sarah Jessica Parker, American actress', 'March 26 – Prakash Raj, Indian actor, producer and director', 'March 29 – Voula Patoulidou, Greek athlete', 'March 30 – Piers Morgan, British journalist and television personality', 'March 31 – Steve Bing, American businessman, philanthropist, and film producer (d. 2020)']"
13,"['April 1\nBrian Marshall, Canadian retired track and field athlete\nBekir Bozdağ, Turkish theologian, lawyer, and politician', 'Brian Marshall, Canadian retired track and field athlete', 'Bekir Bozdağ, Turkish theologian, lawyer, and politician', 'April 3 – Nazia Hassan, Pakistani pop singer-songwriter, lawyer and social activist (d. 2000)', 'April 4 – Robert Downey Jr., American actor, producer, and singer', 'April 6\nBlack Francis, American musician\nRica Reinisch, German swimmer', 'Black Francis, American musician', 'Rica Reinisch, German swimmer', 'April 9 – Paulina Porizkova, Swedish-American model and actress', 'April 10 – Jure Robič, Slovenian cyclist (d. 2010)', 'April 11 – Eelco van Asperen, Dutch computer scientist', 'April 12 – Kim Bodnia, Danish actor and director', 'April 15 – Linda Perry, American musician', 'April 16 – Martin Lawrence, African-American actor, comedian, and producer', 'April 18 – Camille Coduri, English actress', 'April 19 – Suge Knight, African-American record producer', 'April 20 – Jovy Marcelo, Filipino race car driver (d. 1992)', 'April 21\nTatul Krpeyan, Armenian commander (d. 1991)\nJulio Robaina, Republican politician, Mayor of Hialeah, Florida', 'Tatul Krpeyan, Armenian commander (d. 1991)', 'Julio Robaina, Republican politician, Mayor of Hialeah, Florida', 'April 23 – Leni Robredo, 14th Vice President of the Philippines', 'April 24 – Michel Leclerc, French director and screenwriter', 'April 25 – Édouard Ferrand, French politician (d. 2018)', 'April 26 – Kevin James, American comedian and actor', 'April 27 – Edwin Poots, Irish politician', 'April 29 – David Shafer, American politician, Georgia', 'April 30 – Adrian Pasdar, Iranian-American actor and voice artist']"
