Month No.,Month-Day(s)-Events7,"['November 5\n1968 United States presidential election: Republican candidate Richard Nixon defeats the Democratic candidate, Vice President Hubert Humphrey, and American Independent Party candidate George Wallace.\nLuis A. Ferré, of the newly formed New Progressive Party is elected Governor of Puerto Rico, by beating incumbent governor Roberto Sánchez Vilella of the People\'s Party, Luis Negrón López of the Popular Democratic Party and Antonio J. Gonzalez of the Puerto Rican Independence Party, he also becomes the first ""statehooder"" governor of the Island.', '1968 United States presidential election: Republican candidate Richard Nixon defeats the Democratic candidate, Vice President Hubert Humphrey, and American Independent Party candidate George Wallace.', 'Luis A. Ferré, of the newly formed New Progressive Party is elected Governor of Puerto Rico, by beating incumbent governor Roberto Sánchez Vilella of the People\'s Party, Luis Negrón López of the Popular Democratic Party and Antonio J. Gonzalez of the Puerto Rican Independence Party, he also becomes the first ""statehooder"" governor of the Island.', 'November 11 – A second republic is declared in the Maldives.', 'November 15 – Vietnam War: Operation Commando Hunt is initiated to interdict men and supplies on the Ho Chi Minh trail, through Laos into South Vietnam. By the end of the operation, 3\xa0million tons of bombs are dropped on Laos, slowing but not seriously disrupting trail operations.', 'November 17\nBritish European Airways introduces the BAC One-Eleven into commercial service.\nThe Heidi Game: NBC cuts off the final 1:05 of an Oakland Raiders–New York Jets football game to broadcast the pre-scheduled Heidi. Fans are unable to see Oakland (which had been trailing 32–29) score 2 late touchdowns to win 43–32; as a result, thousands of outraged football fans flood the NBC switchboards to protest.', 'British European Airways introduces the BAC One-Eleven into commercial service.', 'The Heidi Game: NBC cuts off the final 1:05 of an Oakland Raiders–New York Jets football game to broadcast the pre-scheduled Heidi. Fans are unable to see Oakland (which had been trailing 32–29) score 2 late touchdowns to win 43–32; as a result, thousands of outraged football fans flood the NBC switchboards to protest.', ""November 19 – In Mali, President Modibo Keïta's regime is overthrown in a bloodless military coup led by Moussa Traoré."", 'November 20 – The Farmington Mine disaster in Farmington, West Virginia, kills seventy-eight men.', 'November 24 – 4 men hijack Pan Am Flight 281 from JFK International Airport, New York to Havana, Cuba.', 'December 9 – Douglas Engelbart publicly demonstrates his pioneering hypertext system, NLS, in San Francisco, together with the computer mouse, at what becomes retrospectively known as ""The Mother of All Demos"".', 'December 10 – Japan\'s biggest heist, the never-solved ""300 million yen robbery"", occurs in Tokyo.', 'December 11\nThe film Oliver! based on the hit London and Broadway musical, opens in the U.S. after being released first in the UK. It goes on to win the Academy Award for Best Picture.', 'The film Oliver! based on the hit London and Broadway musical, opens in the U.S. after being released first in the UK. It goes on to win the Academy Award for Best Picture.']"
8,"['December 13 – Prompted by growing unrest and a perceived proliferation of ""pro-communist"" violent actions, Brazilian president Artur da Costa e Silva enacts the so-called AI-5, the fifth of a series of non-constitutional emergency decrees allegedly to help ""stabilize"" the country after the turmoils of the early 1960s.', 'December 22 – Mao Zedong advocates that educated urban youth in China be sent for re-education in the countryside. It marks the start of the ""Up to the mountains and down to the villages"" movement.', 'December 24 – Apollo program: The crewed U.S. spacecraft Apollo 8 enters orbit around the Moon. Astronauts Frank Borman, Jim Lovell and William Anders become the first humans to see the far side of the Moon and planet Earth as a whole, as well as having traveled further away from Earth than any people in history. Anders photographs Earthrise. The crew also give a reading from the Book of Genesis.', 'December 28 – Israeli forces fly into Lebanese airspace, launching an attack on the airport in Beirut and destroying more than a dozen aircraft.']"
9,"[""The Khmer Rouge is officially formed in Cambodia as an offshoot movement of the Vietnam People's Army from North Vietnam to bring communism to the nation. A few years later, they will become bitter enemies."", 'La Maestra, a Latin American play is written by Enrique Buenaventura.', 'An oil field is confirmed in Northern Alaska: the Prudhoe Bay Oil Field.', 'Midea Group, a well-known home appliance worldwide, founded in Guangdong Province, China.']"
10,"['January 1 – Davor Šuker, Croatian footballer', 'January 2\nViolet Berlin, British presenter and script writer\nCuba Gooding Jr., African-American actor', 'Violet Berlin, British presenter and script writer', 'Cuba Gooding Jr., African-American actor', 'January 3 – Matheus Nachtergaele, Brazilian actor and director', 'January 5\nDJ BoBo, Swiss singer, songwriter and dancer\nAndrzej Gołota, Polish boxer\nCarrie Ann Inaba, American choreographer, game show host and singer', 'DJ BoBo, Swiss singer, songwriter and dancer', 'Andrzej Gołota, Polish boxer', 'Carrie Ann Inaba, American choreographer, game show host and singer', 'January 6\nBlanca Eekhout, Venezuelan politician\nJohn Singleton, African-American film director and writer (d. 2019)', 'Blanca Eekhout, Venezuelan politician', 'John Singleton, African-American film director and writer (d. 2019)', 'January 8 – James Brokenshire, British politician (d. 2021)', 'January 11 – Benjamin List, German organic chemist, recipient of Nobel Prize in Chemistry', 'January 12 – Rachael Harris, American actress and comedian', 'January 13 – Pat Onstad, Canadian footballer', 'January 14 – LL Cool J, African-American rapper and actor', 'January 15 – Chad Lowe, American actor and director', 'January 16\nStephan Pastis, American cartoonist\nAtticus Ross, English musician, songwriter, record producer and audio engineer', 'Stephan Pastis, American cartoonist', 'Atticus Ross, English musician, songwriter, record producer and audio engineer', 'January 17 – Svetlana Masterkova, Russian athlete', 'January 21 – Charlotte Ross, American actress', 'January 22 – Guy Fieri, American chef', 'January 24\nMichael Kiske, German musician\nMary Lou Retton, American gymnast', 'Michael Kiske, German musician', 'Mary Lou Retton, American gymnast', 'January 26\nEric Davis, American football player\nNovala Takemoto, Japanese author and fashion designer', 'Eric Davis, American football player', 'Novala Takemoto, Japanese author and fashion designer', 'January 27 – Mike Patton, American singer', 'January 28 – Sarah McLachlan, Canadian singer', 'January 29 – Edward Burns, American actor', 'January 30 – King Felipe VI of Spain']"
11,"['February 1\nLisa Marie Presley, American singer\nMark Recchi, Canadian ice hockey player\nPauly Shore, American actor', 'Lisa Marie Presley, American singer', 'Mark Recchi, Canadian ice hockey player', 'Pauly Shore, American actor', 'February 3\nDavid Scarboro, English actor (d. 1988)\nVlade Divac, Serbian basketball player\nMarwan Khoury, Lebanese singer and composer', 'David Scarboro, English actor (d. 1988)', 'Vlade Divac, Serbian basketball player', 'Marwan Khoury, Lebanese singer and composer', 'February 5\nRoberto Alomar, American baseball player\nMarcus Grönholm, Finnish rally driver\nQasim Melho, Syrian television actor', 'Roberto Alomar, American baseball player', 'Marcus Grönholm, Finnish rally driver', 'Qasim Melho, Syrian television actor', 'February 7\nPeter Bondra, Slovakian ice hockey player\nPorntip Nakhirunkanok, Miss Universe 1988', 'Peter Bondra, Slovakian ice hockey player', 'Porntip Nakhirunkanok, Miss Universe 1988', 'February 8\nGary Coleman, African-American actor (d. 2010)\nApril Stewart, American voice actress', 'Gary Coleman, African-American actor (d. 2010)', 'April Stewart, American voice actress', 'February 10\nLaurie Foell, New Zealand/Australian actress\nAtika Suri, Indonesian television newscaster', 'Laurie Foell, New Zealand/Australian actress', 'Atika Suri, Indonesian television newscaster', ""February 11\nLavinia Agache, Romanian artistic gymnast\nMo Willems, American children's book author"", 'Lavinia Agache, Romanian artistic gymnast', ""Mo Willems, American children's book author"", 'February 12 – Josh Brolin, American actor', 'February 13\nKelly Hu, American actress, voice artist, former fashion model and beauty queen\nNiamh Kavanagh, Irish singer, Eurovision Song Contest 1993 winner', 'Kelly Hu, American actress, voice artist, former fashion model and beauty queen', 'Niamh Kavanagh, Irish singer, Eurovision Song Contest 1993 winner', 'February 14 – Jules Asner, American model and television personality', 'February 15 – Gloria Trevi, Mexican singer and actress', 'February 18\nMolly Ringwald, American actress\nDennis Satin, German film director', 'Molly Ringwald, American actress', 'Dennis Satin, German film director', 'February 21 – Pellom McDaniels, American football player (d. 2020)', 'February 22\nBradley Nowell, American musician (d. 1996)\nJeri Ryan, American actress', 'Bradley Nowell, American musician (d. 1996)', 'Jeri Ryan, American actress', 'February 24\nAndy Berman, American actor, director, producer, writer, voice artist, and comedian\nMitch Hedberg, American stand-up comedian (d. 2005)', 'Andy Berman, American actor, director, producer, writer, voice artist, and comedian', 'Mitch Hedberg, American stand-up comedian (d. 2005)', 'February 29 – Sam Sneed, American producer and rapper']"
12,"['March 1\nKat Cressida, American voice actress\nKunjarani Devi, Indian weightlifter\nMuho Noelke, German Zen master', 'Kat Cressida, American voice actress', 'Kunjarani Devi, Indian weightlifter', 'Muho Noelke, German Zen master', 'March 2 – Daniel Craig, British actor', 'March 3 – Brian Leetch, American ice hockey player', 'March 4\nGiovanni Carrara, Venezuelan Major League Baseball player\nPatsy Kensit, British actress', 'Giovanni Carrara, Venezuelan Major League Baseball player', 'Patsy Kensit, British actress', 'March 5\nGordon Bajnai, Hungarian Prime Minister\nAmbrose Mandvulo Dlamini, 10th Prime Minister of Eswatini  (d. 2020)', 'Gordon Bajnai, Hungarian Prime Minister', 'Ambrose Mandvulo Dlamini, 10th Prime Minister of Eswatini  (d. 2020)', 'March 6\nMoira Kelly, American actress\nMara Maravilha, Brazilian singer, songwriter, television presenter, actress and businesswoman', 'Moira Kelly, American actress', 'Mara Maravilha, Brazilian singer, songwriter, television presenter, actress and businesswoman', 'March 7 – Jeff Kent, American baseball player', 'March 11 – Lisa Loeb, American singer', 'March 12 – Aaron Eckhart, American actor', 'March 13\nAkira Nogami, Japanese professional wrestler\nMasami Okui, Japanese singer', 'Akira Nogami, Japanese professional wrestler', 'Masami Okui, Japanese singer', 'March 14\nMegan Follows, Canadian-American actress\nJames Frain, British actor', 'Megan Follows, Canadian-American actress', 'James Frain, British actor', 'March 15\nMark McGrath, American singer\nTerje Riis-Johansen, Norwegian politician\nSabrina Salerno, Italian singer', 'Mark McGrath, American singer', 'Terje Riis-Johansen, Norwegian politician', 'Sabrina Salerno, Italian singer', 'March 16\nDavid MacMillan, Scottish-born organic chemist, recipient of Nobel Prize in Chemistry\nTrevor Wilson, American basketball player', 'David MacMillan, Scottish-born organic chemist, recipient of Nobel Prize in Chemistry', 'Trevor Wilson, American basketball player', 'March 20\nCarlos Almeida, Cape Verdean long-distance runner\nUltra Naté, American singer, songwriter, record producer, DJ and promoter', 'Carlos Almeida, Cape Verdean long-distance runner', 'Ultra Naté, American singer, songwriter, record producer, DJ and promoter', 'March 22\nEuronymous, Norwegian musician (d. 1993)', 'Euronymous, Norwegian musician (d. 1993)', 'March 23\nDamon Albarn, English singer-songwriter and musician\nMike Atherton, English cricketer', 'Damon Albarn, English singer-songwriter and musician', 'Mike Atherton, English cricketer', 'March 26\nKenny Chesney, American country music singer\nJames Iha, American rock musician', 'Kenny Chesney, American country music singer', 'James Iha, American rock musician', 'March 27 – Ben Koldyke, American actor', 'March 28 – Iris Chang, American author (d. 2004)', 'March 29 – Lucy Lawless, New Zealand actress and singer', 'March 30 – Celine Dion, Canadian singer']"
13,"['April 1\nJulia Boutros, Lebanese singer\nAndreas Schnaas, German director', 'Julia Boutros, Lebanese singer', 'Andreas Schnaas, German director', 'April 5\nPaula Cole, American singer\nStewart Lee, English stand-up comedian', 'Paula Cole, American singer', 'Stewart Lee, English stand-up comedian', 'April 7 – Jože Možina, Slovenian historian, sociologist and journalist', 'April 8 – Patricia Arquette, American actress', 'April 12 – Ott, English musician and record producer', 'April 13 – Jørn Stubberud, Norwegian musician', 'April 14 – Anthony Michael Hall, American actor and singer', 'April 15 – Stacey Williams, American model', 'April 16\nGreg Baker, American actor and musician\nMartin Dahlin, Swedish football player\nVickie Guerrero, American professional wrestler', 'Greg Baker, American actor and musician', 'Martin Dahlin, Swedish football player', 'Vickie Guerrero, American professional wrestler', 'April 17\nJulie Fagerholt, Danish fashion designer\nAdam McKay, American film director, producer, screenwriter, comedian, and actor', 'Julie Fagerholt, Danish fashion designer', 'Adam McKay, American film director, producer, screenwriter, comedian, and actor', 'April 18 – David Hewlett, English-born Canadian actor, writer and director', 'April 19 – Ashley Judd, American actress', 'April 20\nJ. D. Roth, American television host\nYelena Välbe, Russian cross-country skier', 'J. D. Roth, American television host', 'Yelena Välbe, Russian cross-country skier', 'April 23 – Timothy McVeigh, American terrorist (d. 2001)', 'April 24\nStacy Haiduk, American actress\nJorge Medina, Bolivian civil rights activist and politician (d. 2022)\nYuji Nagata, Japanese professional wrestler', 'Stacy Haiduk, American actress', 'Jorge Medina, Bolivian civil rights activist and politician (d. 2022)', 'Yuji Nagata, Japanese professional wrestler', 'April 28 – Howard Donald, British singer (Take That)', 'April 29\nMichael Herbig, German film director, actor and author\nDarren Matthews, English professional wrestler', 'Michael Herbig, German film director, actor and author', 'Darren Matthews, English professional wrestler']"
