Month No.,Month-Day(s)-Events
1,"['January 1 – Boutros Boutros-Ghali of Egypt replaces Javier Pérez de Cuéllar of Peru as United Nations Secretary-General.', ""January 6\nThe Nagorno-Karabakh Republic is proclaimed by the Armenians of Nagorno-Karabakh.\n1991–92 Georgian coup d'état: President of Georgia Zviad Gamsakhurdia flees the country as a result of the military coup."", 'The Nagorno-Karabakh Republic is proclaimed by the Armenians of Nagorno-Karabakh.', ""1991–92 Georgian coup d'état: President of Georgia Zviad Gamsakhurdia flees the country as a result of the military coup."", 'January 7 – 1992 European Community Monitor Mission helicopter downing: A Yugoslav Air Force Mikoyan-Gurevich MiG-21 attacks two Italian Army Agusta-Bell AB-206L LongRanger helicopters carrying observers from the European Community Monitor Mission. One crashes, killing five people on board. The other helicopter crash-lands, but its occupants survive.', 'January 9\nBosnian Serbs declare their own republic within Bosnia and Herzegovina, in protest of the decision by Bosniaks and Bosnian Croats to seek recognition by the European Communities.\nFirst confirmed detection of exoplanets with announcement of the discovery of several terrestrial-mass planets orbiting the pulsar PSR B1257+12, by radio astronomers Aleksander Wolszczan and Dale Frail working in the United States.', 'Bosnian Serbs declare their own republic within Bosnia and Herzegovina, in protest of the decision by Bosniaks and Bosnian Croats to seek recognition by the European Communities.', 'First confirmed detection of exoplanets with announcement of the discovery of several terrestrial-mass planets orbiting the pulsar PSR B1257+12, by radio astronomers Aleksander Wolszczan and Dale Frail working in the United States.', 'January 15 – The Socialist Federal Republic of Yugoslavia begins to break up; Slovenia and Croatia gain independence and international recognition in some Western countries.', 'January 16 – El Salvador officials and rebel leaders sign the Chapultepec Peace Accords in Mexico City, ending the 12-year Salvadoran Civil War that claimed at least 75,000 lives.', 'January 19\nIn the Bulgarian presidential election, the first held by direct vote, Zhelyu Zhelev, leader of the Union of Democratic Forces, retains office.\nParamount Leader of China Deng Xiaoping speaks in Shenzhen during his southern tour, a move that would return China on its right-wing march towards free market economics.', 'In the Bulgarian presidential election, the first held by direct vote, Zhelyu Zhelev, leader of the Union of Democratic Forces, retains office.', 'Paramount Leader of China Deng Xiaoping speaks in Shenzhen during his southern tour, a move that would return China on its right-wing march towards free market economics.', ""January 22 – Rebel forces occupy Zaire's national radio station in Kinshasa and broadcast a demand for the government's resignation."", 'January 24 – China and Israel establish diplomatic relations.', ""January 26\nBoris Yeltsin announces that Russia will stop targeting cities of the United States and its allies with nuclear weapons. In return President George H. W. Bush announces that the United States and its allies will stop targeting Russia and the remaining communist states with nuclear weapons.\nIn Mauritania, security forces open fire on opponents of President of Mauritania Maaouya Ould Sid'Ahmed Taya, killing at least five people."", 'Boris Yeltsin announces that Russia will stop targeting cities of the United States and its allies with nuclear weapons. In return President George H. W. Bush announces that the United States and its allies will stop targeting Russia and the remaining communist states with nuclear weapons.', ""In Mauritania, security forces open fire on opponents of President of Mauritania Maaouya Ould Sid'Ahmed Taya, killing at least five people."", 'January 27 – First Nagorno-Karabakh War: in the disputed territory of Nagorno-Karabakh, fighting between Armenians and Azeris leaves at least 60 people dead.', ""January 30 – North Korea signs an accord with the International Atomic Energy Agency allowing for international inspections of North Korea's nuclear power plants.""]"
2,"['February 1 – President of the United States George H. W. Bush meets with President of Russia Boris Yeltsin at Camp David, where they formally declare that the Cold War is over.', 'February 3 – South African State President F.W. de Klerk and Nelson Mandela, African National Congress leader, are jointly awarded the Felix Houphouet-Boigny Peace Prize at the UNESCO headquarters in Paris.', 'February 4 – In Venezuela, Hugo Chávez leads an unsuccessful coup attempt against President of Venezuela Carlos Andrés Pérez.', 'February 6 – Queen Elizabeth II of the United Kingdom and other Commonwealth realms celebrates her Ruby Jubilee, marking 40 years since her accession to the thrones of the United Kingdom, Canada, Australia and New Zealand.', 'February 7 – The Maastricht Treaty is signed, founding the European Union.', 'February 8 – The opening ceremony for the 1992 Winter Olympics is held in Albertville, France.', 'February 9 – Algerian Civil War: The government of Algeria declares a state of emergency and begins a crackdown on the Islamic Salvation Front.', ""February 14 – Ukraine and four other nations in the Commonwealth of Independent States reject Russia's proposal to maintain unified armed forces. Ukraine, Moldova and Azerbaijan announce they will go ahead with plans to create their own military forces."", 'February 16 – In Lebanon, Israeli helicopter gunships assassinate Abbas al-Musawi, the leader of Hezbollah, and his son, in retaliation for a February 14 raid that killed three Israeli soldiers.', 'February 17 – A court in Milwaukee, Wisconsin sentences serial killer Jeffrey Dahmer to 15 terms of life in prison. Dahmer is murdered in prison 2 years later.', ""February 18 – Iraq disarmament crisis: The Executive Chairman of UNSCOM details Iraq's refusal to abide by UN Security Council disarmament resolutions."", 'February 21 – The United Nations Security Council approves Resolution 743 to send a UNPROFOR peacekeeping force to Yugoslavia.', 'February 25–26 – 613 Azerbaijani civilians are massacred in Khojaly.', 'February 26 – The Supreme Court of Ireland rules that a 14-year-old rape victim may travel to the United Kingdom to have an abortion.', 'February 28 – Ownership of the port town of Walvis Bay is transferred from South Africa to Namibia.']"
3,"[""March 1 – The first victims of the Bosnian War are a Serb bridegroom's father and an Orthodox priest in a Sarajevo shooting. In the Bosnian independence referendum, held from February 29 to March 1 and boycotted by Bosnian Serbs, the majority of the Bosniak and Bosnian Croat communities have voted for Bosnia-Herzegovina's  independence."", 'March 2 – In Dubăsari, Moldova, escalating tensions turn into open hostilities and the beginning of the Transnistria War.', 'March 4 – The Supreme Court of Algeria bans the Islamic Salvation Front, which is poised to win control of the Parliament of Algeria in runoff elections.', ""March 9 – The People's Republic of China ratifies the Nuclear Non-Proliferation Treaty."", 'March 12 – Mauritius becomes a republic while remaining a member of the Commonwealth of Nations.', 'March 13 – The 6.7 Mw Erzincan earthquake affects eastern Turkey with a maximum Mercalli intensity of VIII (Severe), killing 498–652 and injuring around 2,000.', 'March 18 – White South Africans vote in favour of political reforms which will end the apartheid regime and create a power-sharing multi-racial government.', 'March 22\nIn French regional elections, the conservative Rally for the Republic and the centre-right Union for French Democracy win in a landslide, capturing 20 of 22 metropolitan regional presidencies.\nSTS-45: Space Shuttle Atlantis takes off from Cape Canaveral carrying instruments designed to study global warming.', 'In French regional elections, the conservative Rally for the Republic and the centre-right Union for French Democracy win in a landslide, capturing 20 of 22 metropolitan regional presidencies.', 'STS-45: Space Shuttle Atlantis takes off from Cape Canaveral carrying instruments designed to study global warming.', 'March 24 – The Treaty on Open Skies is signed in Helsinki, Finland, to establish a program of unarmed surveillance flights over the 34 member states. It went into effect on January 1, 2002.', 'March 25\nThe International Atomic Energy Agency orders Iraq to destroy an industrial complex at Al Atheer that is being used to manufacture nuclear weapons.\nPakistan beats England in the final to win the Cricket World Cup for the very first time.', 'The International Atomic Energy Agency orders Iraq to destroy an industrial complex at Al Atheer that is being used to manufacture nuclear weapons.', 'Pakistan beats England in the final to win the Cricket World Cup for the very first time.', 'March 31 – The Maintenance of Religious Harmony Act of Singapore comes into force.']"
4,"['April 5\nThe Assembly of Bosnia and Herzegovina (without the presence of Serb political delegates) proclaims independence from the Socialist Federal Republic of Yugoslavia.\nBosnian War: Serb troops, following a mass rebellion of Serbs in Bosnia and Herzegovina against the Bosnian declaration of independence from Yugoslavia, besiege the city of Sarajevo.\nPresident of Peru Alberto Fujimori issues Decree Law 25418, dissolving the Congress of the Republic of Peru, imposing censorship and having opposition politicians arrested, setting off the 1992 Peruvian constitutional crisis.', 'The Assembly of Bosnia and Herzegovina (without the presence of Serb political delegates) proclaims independence from the Socialist Federal Republic of Yugoslavia.', 'Bosnian War: Serb troops, following a mass rebellion of Serbs in Bosnia and Herzegovina against the Bosnian declaration of independence from Yugoslavia, besiege the city of Sarajevo.', 'President of Peru Alberto Fujimori issues Decree Law 25418, dissolving the Congress of the Republic of Peru, imposing censorship and having opposition politicians arrested, setting off the 1992 Peruvian constitutional crisis.', 'April 6 – The Republic of Ilirida is proclaimed by Albanian Macedonian activists in Struga, Republic of Macedonia.', 'April 7 – The United States recognizes the independence of Slovenia, Croatia, and Bosnia and Herzegovina. The European Communities also recognizes Bosnia and Herzegovina.', ""April 9\nA Miami jury convicts former Panamanian ruler Manuel Noriega of assisting Colombia's cocaine cartel.\nIn the United Kingdom general election the Conservative Party led by Prime Minister of the United Kingdom John Major narrowly retains power."", ""A Miami jury convicts former Panamanian ruler Manuel Noriega of assisting Colombia's cocaine cartel."", 'In the United Kingdom general election the Conservative Party led by Prime Minister of the United Kingdom John Major narrowly retains power.', 'April 10\nFirst Nagorno-Karabakh War: Maraga massacre – At least 43 Armenian civilians are killed as their village of Maraga, Azerbaijan, is captured and destroyed by the Azerbaijani Armed Forces.\nA Provisional Irish Republican Army bomb explodes at the Baltic Exchange in the City of London; three are killed, 91 injured.', 'First Nagorno-Karabakh War: Maraga massacre – At least 43 Armenian civilians are killed as their village of Maraga, Azerbaijan, is captured and destroyed by the Azerbaijani Armed Forces.', 'A Provisional Irish Republican Army bomb explodes at the Baltic Exchange in the City of London; three are killed, 91 injured.', 'April 13 – The 5.3 Mw Roermond earthquake affects the Netherlands, Germany and Belgium with a maximum Mercalli intensity of VII (Very strong).', 'April 15 – The National Assembly of Vietnam adopts the 1992 Constitution of the Socialist Republic of Vietnam.', 'April 16 – President of Afghanistan Mohammad Najibullah is ousted and detained by Muslim rebels moving towards Kabul, setting the stage for the civil war in Afghanistan (1992–96).', 'April 20 – The Freddie Mercury Tribute Concert, held at Wembley Stadium, London, is televised live to over one billion people and raises millions of dollars for AIDS research.', ""April 21 – The death of Grand Duke Vladimir Kirillovich of Russia results in a succession dispute between Nicholas Romanov, Prince of Russia and Vladimir's daughter Maria for the leadership of the Imperial Family of Russia."", 'April 22 – Fuel leaking into a sewer causes a series of explosions in Guadalajara, Mexico; 215 are killed, 1,500 injured.', 'April 27 – Betty Boothroyd becomes the first woman elected Speaker of the House of Commons of the United Kingdom.', 'April 28 – The two remaining constituent republics of the former Socialist Federal Republic of Yugoslavia – Serbia and Montenegro – form a new state, named the Federal Republic of Yugoslavia (which in 2003 becomes Serbia and Montenegro), bringing to an end the official state union of Serbs, Croats, Slovenes, Montenegrins, Bosnian Muslims and Macedonians that has existed since 1918 (with the exception of an occupation period during World War II).', 'April 29\nLos Angeles riots: The acquittal of four police officers in the Rodney King beating criminal trial triggers massive rioting in Los Angeles. The riots will last for six days resulting in 63 deaths and over $1\xa0billion in damages before order is restored by the military.\nIn Sierra Leone, a group of young soldiers launch a military coup that sends president Joseph Saidu Momoh into exile in Guinea, and the National Provisional Ruling Council (NPRC) is established with 25-year-old Captain Valentine Strasser as its chairman and Head of State of the country.', 'Los Angeles riots: The acquittal of four police officers in the Rodney King beating criminal trial triggers massive rioting in Los Angeles. The riots will last for six days resulting in 63 deaths and over $1\xa0billion in damages before order is restored by the military.', 'In Sierra Leone, a group of young soldiers launch a military coup that sends president Joseph Saidu Momoh into exile in Guinea, and the National Provisional Ruling Council (NPRC) is established with 25-year-old Captain Valentine Strasser as its chairman and Head of State of the country.']"
5,"['May 1 – Lithuania introduces a new temporary currency, the talonas.', 'May 5\nRussian leaders in Crimea declare their separation from Ukraine as a new republic. They withdraw the secession on May 10.\nArmand Césari Stadium disaster in Bastia on Corsica: 18 people are killed and 2,300 are injured when one of the terraces collapses before a football match between SC Bastia and Olympique de Marseille.', 'Russian leaders in Crimea declare their separation from Ukraine as a new republic. They withdraw the secession on May 10.', 'Armand Césari Stadium disaster in Bastia on Corsica: 18 people are killed and 2,300 are injured when one of the terraces collapses before a football match between SC Bastia and Olympique de Marseille.', ""May 7\nSTS-49: Space Shuttle Endeavour makes its maiden flight, as a replacement for Space Shuttle Challenger.\nIn the Sydney River McDonald's murders in Nova Scotia, Canada, three McDonald's employees are killed and a fourth is left permanently disabled during a botched robbery."", 'STS-49: Space Shuttle Endeavour makes its maiden flight, as a replacement for Space Shuttle Challenger.', ""In the Sydney River McDonald's murders in Nova Scotia, Canada, three McDonald's employees are killed and a fourth is left permanently disabled during a botched robbery."", 'May 9\nThe United Nations Framework Convention on Climate Change is adopted in New York.\nThe Westray Mine in Plymouth, Nova Scotia, Canada, explodes, killing all 26 miners working the night shift.', 'The United Nations Framework Convention on Climate Change is adopted in New York.', 'The Westray Mine in Plymouth, Nova Scotia, Canada, explodes, killing all 26 miners working the night shift.', 'May 10 – Sweden wins the Ice Hockey World Championships in Czechoslovakia defeating Finland, 5–2, in the final game in Prague.', 'May 13 – Falun Gong is introduced by Li Hongzhi in China.', 'May 15 – The Collective Security Treaty Organization is established by six post-Soviet states belonging to the Commonwealth of Independent States (effective April 20, 1994).', 'May 16–17 – Bosnian War: U.N. peacekeepers withdraw from Sarajevo.', 'May 17 – Protests begin in Bangkok, Thailand, against the government of General Suchinda Kraprayoon, sparking a bloody crackdown.', 'May 23 – Capaci bombing: A Mafia bomb on the autostrada in Sicily kills five people, including Italian anti-Mafia judge Giovanni Falcone.', 'May 24\nIn Thailand, Suchinda Kraprayoon agrees to resign.\nParliamentary election held in Burkina Faso, for the first time since 1978.', 'In Thailand, Suchinda Kraprayoon agrees to resign.', 'Parliamentary election held in Burkina Faso, for the first time since 1978.', 'May 30 – United Nations Security Council Resolution 757 imposes economic sanctions on Yugoslavia in an effort to end its attacks on Bosnia and Herzegovina.']"
6,"['June 2 – In a national referendum Denmark rejects the Maastricht Treaty by a narrow margin.', 'June 3–14 – The Earth Summit is held in Rio de Janeiro.', 'June 8 – The first World Oceans Day is celebrated, coinciding with the Earth Summit held in Rio de Janeiro, Brazil.', 'June 10–26 – Sweden hosts the UEFA Euro 1992 football tournament, which is won by Denmark.', 'June 16 – A ""Joint Understanding"" agreement on arms reduction is signed by U.S. President George H. W. Bush and Russian President Boris Yeltsin (this is later codified in START II).', 'June 17\nTwo German relief workers held since 1989, Thomas Kemptner and Heinrich Struebig, are handed over to the German authorities after their release; they are the last Western hostages in Lebanon.\nViolence breaks out between the African National Congress and the Inkatha Freedom Party in Boipatong, South Africa, leaving 46 dead.', 'Two German relief workers held since 1989, Thomas Kemptner and Heinrich Struebig, are handed over to the German authorities after their release; they are the last Western hostages in Lebanon.', 'Violence breaks out between the African National Congress and the Inkatha Freedom Party in Boipatong, South Africa, leaving 46 dead.', 'June 18 – Ireland votes for the Eleventh Amendment of the Constitution of Ireland to accept the Maastricht Treaty with a popular vote of over 69%.', 'June 20\nEstonia adopts the kroon as currency, becoming the first former Soviet Republic to replace the Soviet rouble.\nIn Paraguay the National Constituent Assembly approves the new Constitution of Paraguay.', 'Estonia adopts the kroon as currency, becoming the first former Soviet Republic to replace the Soviet rouble.', 'In Paraguay the National Constituent Assembly approves the new Constitution of Paraguay.', 'June 21 – Nelson Mandela announces that the African National Congress will halt negotiations with the government of South Africa following the Boipatong massacre of June 17.', 'June 23 – The Israeli legislative election is won by the Israeli Labor Party under the leadership of Yitzhak Rabin, ousting a Likud government.', 'June 25 – The Black Sea Economic Cooperation (BSEC) is founded.', 'June 26 – Denmark beats Germany 2–0 in the final to win the 1992 UEFA European Football Championship at Ullevi Stadium in Gothenburg, Sweden.', 'June 28 – Estonia holds a referendum on its constitution, which will come into effect on July 3.']"
7,"['July 6–8 – The 18th G7 summit is held in Munich.', 'July 6–29 – Iraq disarmament crisis: Iraq refuses a U.N. inspection team access to the Iraqi Ministry of Agriculture. UNSCOM claims that it has reliable information that the site contains archives related to illegal weapons activities. U.N. inspectors stage a 17-day ""sit-in"" outside of the building, but leave when their safety is threatened by Iraqi soldiers.', 'July 10\nIn Miami, former Panamanian dictator Manuel Noriega is sentenced to 40 years in prison for participating in the illegal drug trade and racketeering.\nThe Giotto spacecraft flies past Comet 26P/Grigg–Skjellerup, gathering measurements about the comet.', 'In Miami, former Panamanian dictator Manuel Noriega is sentenced to 40 years in prison for participating in the illegal drug trade and racketeering.', 'The Giotto spacecraft flies past Comet 26P/Grigg–Skjellerup, gathering measurements about the comet.', 'July 13 – Yitzhak Rabin becomes prime minister of Israel.', 'July 16 – At the 1992 Democratic National Convention, Arkansas Governor Bill Clinton accepts his party\'s presidential nomination on behalf of the ""forgotten middle class"".', 'July 17 – The Slovak National Council declares Slovakia an independent country, signaling the breakup of Czechoslovakia.', ""July 19\nVia D'Amelio bombing: A car bomb placed by the Sicilian Mafia (with the collaboration of Italian intelligence) kills judge Paolo Borsellino and five members of his police escort.\nThe Cabinet of Israel approves a freeze on new Israeli settlement in the occupied territories, a move expected to reinvigorate the Middle East Peace Process."", ""Via D'Amelio bombing: A car bomb placed by the Sicilian Mafia (with the collaboration of Italian intelligence) kills judge Paolo Borsellino and five members of his police escort."", 'The Cabinet of Israel approves a freeze on new Israeli settlement in the occupied territories, a move expected to reinvigorate the Middle East Peace Process.', 'July 20 – Václav Havel resigns as president of Czechoslovakia.', 'July 21 – Transnistria War ends with a ceasefire.', 'July 22 – Near Medellín, Colombian drug lord Pablo Escobar escapes from his luxury prison, fearing extradition to the United States.', 'July 23 – Abkhazia declares independence from Georgia.', 'July 25–August 9 – The 1992 Summer Olympics are held in Barcelona, Catalonia, Spain.', 'July 26 – Iraq agrees to allow U.N. weapons inspectors to search the Iraqi Agricultural Ministry building in Baghdad. When inspectors arrive on July 28 and 29, they find nothing and voice suspicions that Iraqi records have been removed.', 'July 31\nGeorgia becomes the 179th member of the United Nations after seceding from the Soviet Union the previous year.\nThai Airways International Flight 311, an Airbus A310-300, crashes into a mountain north of Kathmandu, Nepal killing all 113 people on board.\nChina General Aviation Flight 7552 bound for Xiamen crashes soon after taking off from Nanjing Dajiaochang Airport, killing 108 of the 116 people on board.', 'Georgia becomes the 179th member of the United Nations after seceding from the Soviet Union the previous year.', 'Thai Airways International Flight 311, an Airbus A310-300, crashes into a mountain north of Kathmandu, Nepal killing all 113 people on board.', 'China General Aviation Flight 7552 bound for Xiamen crashes soon after taking off from Nanjing Dajiaochang Airport, killing 108 of the 116 people on board.']"
8,"['August 3–4 – Millions of black South Africans participate in a general strike called by the African National Congress to protest the lack of progress in negotiations with the government of State President of South Africa F. W. de Klerk.', 'August 12 – Canada, Mexico and the United States announce that a deal has been reached on the North American Free Trade Agreement; this will be formally signed on December 17.', 'August 18 – Prime Minister of the United Kingdom John Major announces the creation of Iraqi no-fly zones (→ Operation Southern Watch).', 'August 24\nConcordia University massacre: Valery Fabrikant murders four colleagues and seriously wounds another in a shooting at Concordia University, in Montreal, Quebec.\nChina and South Korea establish diplomatic relations.', 'Concordia University massacre: Valery Fabrikant murders four colleagues and seriously wounds another in a shooting at Concordia University, in Montreal, Quebec.', 'China and South Korea establish diplomatic relations.', 'August 24–28 – Hurricane Andrew hits south Florida and Louisiana and dissipates over the Tennessee valley when it merges with a storm system; 23 are killed.', 'August 29 – In Rostock, Germany, tens of thousands rally to protest neo-Nazi attacks on refugees and immigrants begun on August 22.']"
