Month No.,Month-Day(s)-Events9,"['September 1 – In Beijing, police arrest Shen Tong for his role in organizing the Tiananmen Square protests of 1989.', 'September 2 – The 7.7 Mw Nicaragua earthquake affects the west coast of Nicaragua. With a Ms\u202f–Mw\u202f disparity of half a unit, this tsunami earthquake triggers a tsunami that causes most of the damage and casualties, with at least 116 killed. Average runup heights are 3–8 meters (9.8–26.2\xa0ft).', 'September 7\nIn Ciskei, members of the Ciskei Defence Force loyal to dictator Oupa Gqozo open fire into a crowd of anti-Gqozo protestors organized by the African National Congress, killing at least 28 people and wounding nearly 200.\nPresident of Tajikistan Rahmon Nabiyev is forced to resign following weeks of clan and religious warfare that have left nearly 2,000 people dead.', 'In Ciskei, members of the Ciskei Defence Force loyal to dictator Oupa Gqozo open fire into a crowd of anti-Gqozo protestors organized by the African National Congress, killing at least 28 people and wounding nearly 200.', 'President of Tajikistan Rahmon Nabiyev is forced to resign following weeks of clan and religious warfare that have left nearly 2,000 people dead.', 'September 11 – Hurricane Iniki hits the Hawaiian Islands, Kauai and Oahu.', 'September 12 – In Peru, police arrest Abimael Guzmán, the leader of the Shining Path guerilla movement, who has evaded capture for 12 years.', 'September 16 – Black Wednesday: The pound sterling and the Italian lira are forced out of the European Exchange Rate Mechanism.', 'September 17 – Two Kurdish opposition leaders are assassinated by the Iranian Kazem Darabi and the Lebanese Abbas Rhayel.', 'September 20 – French voters narrowly approve the Maastricht Treaty in the French Maastricht Treaty referendum.', 'September 21 – Mexico establishes diplomatic relations with Vatican City, ending a break that has lasted over 130 years.', 'September 28 – Law enforcement officials in the United States, Colombia and Italy announce that they have arrested more than 165 people on money laundering charges related to cocaine trafficking.', ""September 29 – The Chamber of Deputies of Brazil votes to impeach President of Brazil Fernando Collor de Mello, the country's first democratically elected leader in 29 years. Vice President Itamar Franco becomes acting president.""]"
10,"['October 2 – A riot breaks out in the Carandiru Penitentiary in São Paulo, Brazil, resulting in the Carandiru massacre.', ""October 3 – After performing a song protesting against alleged Catholic Church child sexual abuse, Irish singer-songwriter Sinéad O'Connor rips up a photograph of Pope John Paul II on the US television programme Saturday Night Live, causing huge controversy."", ""October 4\nThe government of Mozambique signs the Rome General Peace Accords with leaders of RENAMO, ending the 16-year-old Mozambican Civil War.\nIsraeli cargo plane El Al Flight 1862 crashes into residential buildings in Amsterdam's Bijlmermeer, Netherlands, after taking off from Schiphol Airport and losing two engines, killing all 4 people on board and 39 on the ground."", 'The government of Mozambique signs the Rome General Peace Accords with leaders of RENAMO, ending the 16-year-old Mozambican Civil War.', ""Israeli cargo plane El Al Flight 1862 crashes into residential buildings in Amsterdam's Bijlmermeer, Netherlands, after taking off from Schiphol Airport and losing two engines, killing all 4 people on board and 39 on the ground."", 'October 6 – Lennart Meri becomes the first President of Estonia after regaining independence. The Estonian Government in Exile resigns on the next day.', 'October 7 – In Peru, Shining Path leader Abimael Guzmán is convicted of treason and sentenced to life in prison.', 'October 11 – The Catechism of the Catholic Church is promulgated by Pope John Paul II with his apostolic constitution, Fidei depositum.', 'October 12\nIn the Dominican Republic, Pope John Paul II celebrates the 500th anniversary of the meeting of two cultures.\nThe 5.8 mb Cairo earthquake affects the city with a maximum Mercalli intensity of VIII (Severe), leaving 545 dead and 6,512 injured.', 'In the Dominican Republic, Pope John Paul II celebrates the 500th anniversary of the meeting of two cultures.', 'The 5.8 mb Cairo earthquake affects the city with a maximum Mercalli intensity of VIII (Severe), leaving 545 dead and 6,512 injured.', 'October 19 – The Chinese Communist Party promotes several market-oriented reformers to the Politburo Standing Committee of the Chinese Communist Party, signaling a defeat for hard-line ideologues.', 'October 21 – 150,000 coal miners march in London to protest government plans to close coal mines and reduce the number of miners.', 'October 23 – Emperor of Japan Akihito begins the first imperial visit to China, telling a Beijing audience he feels deep sorrow for the suffering of the Chinese people during World War II.', 'October 25 – Lithuania holds a referendum on its first constitution after declaring independence from the Soviet Union in 1990.', 'October 26 – In a national referendum, voters in Canada reject the Charlottetown Accord.', 'October 31 – Pope John Paul II issues an apology and lifts the 1633 edict of the Inquisition against Galileo Galilei.']"
11,"['November 3 – In the 1992 United States presidential election, Democratic Arkansas Governor Bill Clinton defeats Republican President  George H. W. Bush and Independent Ross Perot.', 'November 8 – More than 350,000 people rally in Berlin to protest right-wing violence against immigrants; stones and eggs are thrown at President of Germany Richard von Weizsäcker and Chancellor of Germany Helmut Kohl.', 'November 11 – The Church of England votes to allow women to become priests.', 'November 13\nThe government of Peru announces it has arrested a small group of army officers who were plotting the assassination of President Alberto Fujimori.\nA report by the World Meteorological Organization reports an unprecedented level of ozone depletion in both the Arctic and Antarctic.', 'The government of Peru announces it has arrested a small group of army officers who were plotting the assassination of President Alberto Fujimori.', 'A report by the World Meteorological Organization reports an unprecedented level of ozone depletion in both the Arctic and Antarctic.', 'November 14 –  In poor conditions caused by Cyclone Forrest, Vietnam Airlines Flight 474 crashes near Nha Trang, killing 30.', 'November 15 – The Lithuanian parliamentary election sees the Communists of the Democratic Labour Party of Lithuania, led by Algirdas Brazauskas, return to power.', 'November 18 – Russian President Boris Yeltsin releases the flight data recorder (FDR) and cockpit voice recorder (CVR) of Korean Air Flight 007, which was shot down by the Soviets in 1983.', 'November 24 – In China, China Southern Airlines Flight 3943, a China Southern Airlines domestic flight, crashes, killing all 141 people on board.', 'November 25\nThe Czechoslovakia Federal Assembly votes to split the country into the Czech Republic and Slovakia, starting on January 1, 1993.\nIn a national referendum related to abortion, voters in Ireland reject the proposed Twelfth Amendment of the Constitution Bill 1992 but approve the Thirteenth Amendment of the Constitution of Ireland and the Fourteenth Amendment of the Constitution of Ireland.', 'The Czechoslovakia Federal Assembly votes to split the country into the Czech Republic and Slovakia, starting on January 1, 1993.', 'In a national referendum related to abortion, voters in Ireland reject the proposed Twelfth Amendment of the Constitution Bill 1992 but approve the Thirteenth Amendment of the Constitution of Ireland and the Fourteenth Amendment of the Constitution of Ireland.', 'November 27 – The government of Venezuela puts down a coup attempt by a group of Air Force officers who have bombed the presidential palace.']"
12,"[""December 1 – South Korea and South Africa reestablish diplomatic relations. South Korea previously had diplomatic relations with South Africa from 1961 to 1978, when they were severed by the former due to the latter's policy of apartheid."", 'December 3 – UN Security Council Resolution 794 is unanimously passed, approving a coalition of United Nations peacekeepers led by the United States to form UNITAF, tasked with ensuring that humanitarian aid gets distributed and establishing peace in Somalia.', 'December 4 – U.S. military forces land in Somalia.', 'December 6 – Demolition of Babri Masjid: Extremist Hindu activists in India demolish Babri Masjid – a 16th-century mosque in Ayodhya which has been used as a temple since 1949 – leading to widespread communal violence, including the Bombay riots, in all killing over 1,500 people.', 'December 12 – The 7.8 Mw Flores earthquake affects the Lesser Sunda Islands in Indonesia with a maximum Mercalli intensity of VIII (Severe) leaving at least 2,500 dead. A destructive tsunami with wave heights of 25\xa0m (82\xa0ft) follows.', 'December 16 – The Czech National Council adopts the Constitution of the Czech Republic.', 'December 18 – The South Korean presidential election is won by Kim Young-sam, the first non-military candidate elected since 1961.', 'December 21 – President of Serbia Slobodan Milošević defeats Milan Panić in the Serbian presidential election.', 'December 22 – The Archives of Terror are discovered by Dr. Martín Almada in Asunción, detailing the fates of thousands of Latin Americans who have been secretly kidnapped, tortured and killed by the security services of Argentina, Bolivia, Brazil, Chile, Paraguay and Uruguay in Operation Condor.']"
13,"['January 1\nShane Duffy, Irish footballer\nHe Kexin, Chinese artistic gymnast', 'Shane Duffy, Irish footballer', 'He Kexin, Chinese artistic gymnast', 'January 3 – Gao Lei, Chinese trampoline gymnast', 'January 4\nSajjad Ganjzadeh, Iranian karateka\nQuincy Promes, Dutch footballer', 'Sajjad Ganjzadeh, Iranian karateka', 'Quincy Promes, Dutch footballer', 'January 5 – Trent Sainsbury, Australian footballer', 'January 7 - Edgaras Ulanovas (basketball player, born 1992), Lithuanian basketball player', 'January 8 – Koke, Spanish footballer', 'January 9 – Fang Bo, Chinese table tennis player', 'January 10\nChristian Atsu, Ghanaian footballer\nŠime Vrsaljko, Croatian footballer', 'Christian Atsu, Ghanaian footballer', 'Šime Vrsaljko, Croatian footballer', 'January 11 – Dani Carvajal, Spanish footballer', 'January 13 – Santiago Arias, Colombian footballer', 'January 14 – Robbie Brady, Irish footballer', 'January 19\nShawn Johnson East, American Olympic gymnast\nLogan Lerman, American actor\nMac Miller, American rapper, singer-songwriter, and record producer (d. 2018)', 'Shawn Johnson East, American Olympic gymnast', 'Logan Lerman, American actor', 'Mac Miller, American rapper, singer-songwriter, and record producer (d. 2018)', 'January 26\nVincent Aboubakar, Cameroonian footballer\nSasha Banks, American professional wrestler', 'Vincent Aboubakar, Cameroonian footballer', 'Sasha Banks, American professional wrestler', 'January 31 – Tyler Seguin, Canadian ice hockey player']"
